Claude Opus 4.5,760,347,https://www.anthropic.com/news/claude-opus-4-5,2025-11-25 02:06:34.284360
Show HN: I built an interactive HN Simulator,163,88,https://news.ysimulator.run/news,2025-11-25 02:06:34.396635
Moving from OpenBSD to FreeBSD for firewalls,144,72,https://utcc.utoronto.ca/~cks/space/blog/sysadmin/OpenBSDToFreeBSDMove,2025-11-25 02:06:34.506316
Random lasers from peanut kernel doped with birch leaf–derived carbon dots,16,3,https://www.degruyterbrill.com/document/doi/10.1515/nanoph-2025-0312/html,2025-11-25 02:06:34.619529
The Bitter Lesson of LLM Extensions,83,45,https://www.sawyerhood.com/blog/llm-extension,2025-11-25 02:06:34.734650
Build a Compiler in Five Projects,14,0,https://kmicinski.com/functional-programming/2025/11/23/build-a-language/,2025-11-25 02:06:34.843919
Show HN: OCR Arena – A playground for OCR models,60,21,https://www.ocrarena.ai/battle,2025-11-25 02:06:34.956700
What OpenAI did when ChatGPT users lost touch with reality,106,112,https://www.nytimes.com/2025/11/23/technology/openai-chatgpt-users-risks.html,2025-11-25 02:06:35.068957
PS5 now costs less than 64GB of DDR5 memory. RAM jumps to $600 due to shortage,278,165,https://www.tomshardware.com/pc-components/ddr5/64gb-of-ddr5-memory-now-costs-more-than-an-entire-ps5-even-after-a-discount-trident-z5-neo-kit-jumps-to-usd600-due-to-dram-shortage-and-its-expected-to-get-worse-into-2026,2025-11-25 02:06:35.183751
How sea turtles learn locations using Earth’s magnetic field: research,12,1,https://uncnews.unc.edu/2025/02/13/sea-turtles-secret-gps-researchers-uncover-how-sea-turtles-learn-locations-using-earths-magnetic-field/,2025-11-25 02:06:35.296352
Chrome Jpegxl Issue Reopened,213,80,https://issues.chromium.org/issues/40168998,2025-11-25 02:06:35.413916
Google's new 'Aluminium OS' project brings Android to PC,54,54,https://www.androidauthority.com/aluminium-os-android-for-pcs-3619092/,2025-11-25 02:06:35.528997
Shai-Hulud Returns: Over 300 NPM Packages Infected,870,693,https://helixguard.ai/blog/malicious-sha1hulud-2025-11-24,2025-11-25 02:06:35.639515
A Major City of the Kazakh Steppe? Investigating Semiyarka's Bronze Age Legacy,3,0,https://www.cambridge.org/core/journals/antiquity/article/major-city-of-the-kazakh-steppe-investigating-semiyarkas-bronze-age-legacy/7D20FEEC9B8F7BC60721BF7CA401B788,2025-11-25 02:06:35.756533
Neopets.com changed my life (2019),59,43,https://annastreetman.com/2019/05/19/how-neopets-com-changed-my-life/,2025-11-25 02:06:35.866541
"Bytes before FLOPS: your algorithm is (mostly) fine, your data isn't",40,8,https://www.bitsdraumar.is/bytes-before-flops/,2025-11-25 02:06:35.978435
Fifty Shades of OOP,49,8,https://lesleylai.info/en/fifty_shades_of_oop/,2025-11-25 02:06:36.096299
"Corvus Robotics (YC S18): Hiring Head of Mfg/Ops, Next Door to YC Mountain View",1,0,https://news.ycombinator.com/item?id=46036222,2025-11-25 02:06:36.206468
Everything you need to know about hard drive vibration (2016),23,6,https://www.ept.ca/features/everything-need-know-hard-drive-vibration/,2025-11-25 02:06:36.321636
"TSMC Arizona outage saw fab halt, Apple wafers scrapped",174,67,https://www.culpium.com/p/tsmc-arizona-outage-saw-fab-halt,2025-11-25 02:06:36.432706
Mind-reading devices can now predict preconscious thoughts,122,81,https://www.nature.com/articles/d41586-025-03714-0,2025-11-25 02:06:36.565040
Building the largest known Kubernetes cluster,103,65,https://cloud.google.com/blog/products/containers-kubernetes/how-we-built-a-130000-node-gke-cluster/,2025-11-25 02:06:36.679040
You can see a working Quantum Computer in IBM's London office,38,8,https://www.ianvisits.co.uk/articles/you-can-see-a-working-quantum-computer-in-ibms-london-office-85464/,2025-11-25 02:06:36.790683
"Launch HN: Karumi (YC F25) – Personalized, agentic product demos",30,11,http://karumi.ai/,2025-11-25 02:06:36.901219
The history of Indian science fiction,96,6,https://altermag.com/articles/the-secret-history-of-indian-science-fiction,2025-11-25 02:06:37.014355
Pebble Watch software is now 100% open source,843,130,https://ericmigi.com/blog/pebble-watch-software-is-now-100percent-open-source,2025-11-25 06:42:47.354215
Unpowered SSDs slowly lose data,348,148,https://www.xda-developers.com/your-unpowered-ssd-is-slowly-losing-your-data/,2025-11-25 06:42:47.439675
Claude Advanced Tool Use,444,169,https://www.anthropic.com/engineering/advanced-tool-use,2025-11-25 06:42:47.528840
Human brains are preconfigured with instructions for understanding the world,3,0,https://news.ucsc.edu/2025/11/sharf-preconfigured-brain/,2025-11-25 06:42:47.617712
"Windows GUI – Good, Bad and Pretty Ugly (2023)",8,1,https://creolened.com/windows-gui-good-bad-and-pretty-ugly-ranked/,2025-11-25 06:42:47.701731
A million ways to die from a data race in Go,32,11,https://gaultier.github.io/blog/a_million_ways_to_data_race_in_go.html,2025-11-25 06:42:47.792304
Show HN: I built an interactive HN Simulator,256,126,https://news.ysimulator.run/news,2025-11-25 06:42:47.879237
Cool-retro-term: terminal emulator which mimics look and feel of CRTs,207,80,https://github.com/Swordfish90/cool-retro-term,2025-11-25 06:42:47.971698
How did the Windows 95 user interface code get to the Windows NT code base?,50,12,https://devblogs.microsoft.com/oldnewthing/20251028-00/?p=111733,2025-11-25 06:42:48.060971
Three Years from GPT-3 to Gemini 3,249,160,https://www.oneusefulthing.org/p/three-years-from-gpt-3-to-gemini,2025-11-25 06:42:48.149784
Implications of AI to schools,168,170,https://twitter.com/karpathy/status/1993010584175141038,2025-11-25 06:42:48.240613
Show HN: OCR Arena – A playground for OCR models,115,43,https://www.ocrarena.ai/battle,2025-11-25 06:42:48.329961
Claude Opus 4.5,878,397,https://www.anthropic.com/news/claude-opus-4-5,2025-11-25 06:42:48.417726
What OpenAI did when ChatGPT users lost touch with reality,166,198,https://www.nytimes.com/2025/11/23/technology/openai-chatgpt-users-risks.html,2025-11-25 06:42:48.502933
Migrating to Bazel symbolic macros,10,0,https://www.tweag.io/blog/2025-11-20-migrating-bazel-symbolic-macros/,2025-11-25 06:42:48.588439
Build a Compiler in Five Projects,82,10,https://kmicinski.com/functional-programming/2025/11/23/build-a-language/,2025-11-25 06:42:48.678643
The Bitter Lesson of LLM Extensions,105,53,https://www.sawyerhood.com/blog/llm-extension,2025-11-25 06:42:48.768874
Google's new 'Aluminium OS' project brings Android to PC,96,117,https://www.androidauthority.com/aluminium-os-android-for-pcs-3619092/,2025-11-25 06:42:48.852384
Chrome Jpegxl Issue Reopened,230,86,https://issues.chromium.org/issues/40168998,2025-11-25 06:42:48.937878
Shai-Hulud Returns: Over 300 NPM Packages Infected,907,708,https://helixguard.ai/blog/malicious-sha1hulud-2025-11-24,2025-11-25 06:42:49.028670
Moving from OpenBSD to FreeBSD for firewalls,167,92,https://utcc.utoronto.ca/~cks/space/blog/sysadmin/OpenBSDToFreeBSDMove,2025-11-25 06:42:49.116199
Show HN: Datamorph – A clean JSON ⇄ CSV converter with auto-detect,4,1,https://datamorphio.vercel.app,2025-11-25 06:42:49.206002
Using Antigravity for Statistical Physics in JavaScript,12,9,https://christopherkrapu.com/blog/2025/antigravity-stat-mech/,2025-11-25 06:42:49.294759
Fifty Shades of OOP,79,30,https://lesleylai.info/en/fifty_shades_of_oop/,2025-11-25 06:42:49.391346
PS5 now costs less than 64GB of DDR5 memory. RAM jumps to $600 due to shortage,343,217,https://www.tomshardware.com/pc-components/ddr5/64gb-of-ddr5-memory-now-costs-more-than-an-entire-ps5-even-after-a-discount-trident-z5-neo-kit-jumps-to-usd600-due-to-dram-shortage-and-its-expected-to-get-worse-into-2026,2025-11-25 06:42:49.479074
Building the largest known Kubernetes cluster,121,69,https://cloud.google.com/blog/products/containers-kubernetes/how-we-built-a-130000-node-gke-cluster/,2025-11-25 06:42:49.565493
The history of Indian science fiction,148,21,https://altermag.com/articles/the-secret-history-of-indian-science-fiction,2025-11-25 06:42:49.653104
Inside Rust's std and parking_lot mutexes – who wins?,150,69,https://blog.cuongle.dev/p/inside-rusts-std-and-parking-lot-mutexes-who-win,2025-11-25 06:42:49.755423
"Bytes before FLOPS: your algorithm is (mostly) fine, your data isn't",49,11,https://www.bitsdraumar.is/bytes-before-flops/,2025-11-25 06:42:49.860927
"Corvus Robotics (YC S18): Hiring Head of Mfg/Ops, Next Door to YC Mountain View",1,0,https://news.ycombinator.com/item?id=46036222,2025-11-25 06:42:49.947938
Pebble Watch software is now open source,1041,194,https://ericmigi.com/blog/pebble-watch-software-is-now-100percent-open-source,2025-11-25 12:58:18.567121
Most Stable Raspberry Pi? 81% Better NTP with Thermal Management,159,49,https://austinsnerdythings.com/2025/11/24/worlds-most-stable-raspberry-pi-81-better-ntp-with-thermal-management/,2025-11-25 12:58:18.653580
Human brains are preconfigured with instructions for understanding the world,169,107,https://news.ucsc.edu/2025/11/sharf-preconfigured-brain/,2025-11-25 12:58:18.747918
Unpowered SSDs slowly lose data,523,225,https://www.xda-developers.com/your-unpowered-ssd-is-slowly-losing-your-data/,2025-11-25 12:58:18.835487
Meta Segment Anything Model 3,21,2,https://ai.meta.com/blog/segment-anything-model-3/?_fb_noscript=1,2025-11-25 12:58:18.924861
"Broccoli Man, Remastered",24,3,https://mbleigh.dev/posts/broccoli-man-remastered/,2025-11-25 12:58:19.011948
Claude Advanced Tool Use,537,219,https://www.anthropic.com/engineering/advanced-tool-use,2025-11-25 12:58:19.098489
Using an Array of Needles to Create Solid Knitted Shapes,25,3,https://dl.acm.org/doi/10.1145/3746059.3747759,2025-11-25 12:58:19.188113
Show HN: I built an interactive HN Simulator,375,175,https://news.ysimulator.run/news,2025-11-25 12:58:19.270645
How the Atomic Tests Looked Like from Los Angeles,65,37,https://www.amusingplanet.com/2016/09/how-atomic-tests-looked-like-from-los.html,2025-11-25 12:58:19.355598
Cool-retro-term: terminal emulator which mimics look and feel of CRTs,248,91,https://github.com/Swordfish90/cool-retro-term,2025-11-25 12:58:19.443966
Implications of AI to schools,247,271,https://twitter.com/karpathy/status/1993010584175141038,2025-11-25 12:58:19.550801
Dumb Ways to Die: Printed Ephemera,20,13,https://ilovetypography.com/2025/11/19/dumb-ways-to-die-printed-ephemera/,2025-11-25 12:58:20.195389
Build a Compiler in Five Projects,132,23,https://kmicinski.com/functional-programming/2025/11/23/build-a-language/,2025-11-25 12:58:20.279661
What OpenAI did when ChatGPT users lost touch with reality,213,321,https://www.nytimes.com/2025/11/23/technology/openai-chatgpt-users-risks.html,2025-11-25 12:58:20.363051
Show HN: OCR Arena – A playground for OCR models,160,51,https://www.ocrarena.ai/battle,2025-11-25 12:58:20.448582
"Rethinking C++: Architecture, Concepts, and Responsibility",31,19,https://blogs.embarcadero.com/rethinking-c-architecture-concepts-and-responsibility/,2025-11-25 12:58:20.535098
Claude Opus 4.5,986,448,https://www.anthropic.com/news/claude-opus-4-5,2025-11-25 12:58:20.618057
How did the Win 95 user interface code get brought to the Windows NT code base?,108,61,https://devblogs.microsoft.com/oldnewthing/20251028-00/?p=111733,2025-11-25 12:58:20.705073
Chrome Jpegxl Issue Reopened,260,119,https://issues.chromium.org/issues/40168998,2025-11-25 12:58:20.809832
Google's new 'Aluminium OS' project brings Android to PC,136,189,https://www.androidauthority.com/aluminium-os-android-for-pcs-3619092/,2025-11-25 12:58:20.904097
Shai-Hulud Returns: Over 300 NPM Packages Infected,961,728,https://helixguard.ai/blog/malicious-sha1hulud-2025-11-24,2025-11-25 12:58:20.989902
The Bitter Lesson of LLM Extensions,124,65,https://www.sawyerhood.com/blog/llm-extension,2025-11-25 12:58:21.072076
Fifty Shades of OOP,117,67,https://lesleylai.info/en/fifty_shades_of_oop/,2025-11-25 12:58:21.158518
Building the largest known Kubernetes cluster,136,77,https://cloud.google.com/blog/products/containers-kubernetes/how-we-built-a-130000-node-gke-cluster/,2025-11-25 12:58:21.245403
AI has a deep understanding of how this code works,145,49,https://github.com/ocaml/ocaml/pull/14369,2025-11-25 12:58:21.329556
Three Years from GPT-3 to Gemini 3,295,217,https://www.oneusefulthing.org/p/three-years-from-gpt-3-to-gemini,2025-11-25 12:58:21.411627
Inside Rust's std and parking_lot mutexes – who wins?,180,81,https://blog.cuongle.dev/p/inside-rusts-std-and-parking-lot-mutexes-who-win,2025-11-25 12:58:21.501123
PS5 now costs less than 64GB of DDR5 memory. RAM jumps to $600 due to shortage,417,282,https://www.tomshardware.com/pc-components/ddr5/64gb-of-ddr5-memory-now-costs-more-than-an-entire-ps5-even-after-a-discount-trident-z5-neo-kit-jumps-to-usd600-due-to-dram-shortage-and-its-expected-to-get-worse-into-2026,2025-11-25 12:58:21.587300
Using Antigravity for Statistical Physics in JavaScript,27,22,https://christopherkrapu.com/blog/2025/antigravity-stat-mech/,2025-11-25 12:58:21.672188
"Show HN: We built an open source, zero webhooks payment processor",73,55,https://github.com/flowglad/flowglad,2025-11-25 18:41:09.361776
Google Antigravity Exfiltrates Data,21,2,https://www.promptarmor.com/resources/google-antigravity-exfiltrates-data,2025-11-25 18:41:09.461055
FLUX.2: Frontier Visual Intelligence,108,38,https://bfl.ai/blog/flux-2,2025-11-25 18:41:09.555757
Launch HN: Onyx (YC W24) – Open-source chat UI,97,87,https://news.ycombinator.com/item?id=46045987,2025-11-25 18:41:09.655364
The 101 of analog signal filtering (2024),51,2,https://lcamtuf.substack.com/p/the-101-of-analog-signal-filtering,2025-11-25 18:41:09.756121
"It is ok to say ""CSS variables"" instead of ""custom properties""",35,14,https://blog.kizu.dev/css-variables/,2025-11-25 18:41:09.854556
Human brains are preconfigured with instructions for understanding the world,339,227,https://news.ucsc.edu/2025/11/sharf-preconfigured-brain/,2025-11-25 18:41:09.964009
Making Crash Bandicoot (2011),145,10,https://all-things-andy-gavin.com/video-games/making-crash/,2025-11-25 18:41:10.140750
Trillions spent and big software projects are still failing,98,84,https://spectrum.ieee.org/it-management-software-failures,2025-11-25 18:41:10.321112
"Ozempic does not slow Alzheimer's, study finds",50,36,https://www.semafor.com/article/11/25/2025/ozempic-does-not-slow-alzheimers-study-finds,2025-11-25 18:41:10.421264
Python is not a great language for data science,35,28,https://blog.genesmindsmachines.com/p/python-is-not-a-great-language-for,2025-11-25 18:41:10.521751
how to repurpose your old phone into a web server,11,0,https://far.computer/how-to/,2025-11-25 18:41:10.620647
Most Stable Raspberry Pi? Better NTP with Thermal Management,245,76,https://austinsnerdythings.com/2025/11/24/worlds-most-stable-raspberry-pi-81-better-ntp-with-thermal-management/,2025-11-25 18:41:10.719106
LPLB: An early research stage MoE load balancer based on linear programming,10,0,https://github.com/deepseek-ai/LPLB,2025-11-25 18:41:10.827957
Unpowered SSDs slowly lose data,660,273,https://www.xda-developers.com/your-unpowered-ssd-is-slowly-losing-your-data/,2025-11-25 18:41:10.929393
Roblox is a problem but it's a symptom of something worse,85,120,https://www.platformer.news/roblox-ceo-interview-backlash-analysis/,2025-11-25 18:41:11.025562
Jakarta is now the biggest city in the world,33,7,https://www.axios.com/2025/11/24/jakarta-tokyo-worlds-biggest-city-population,2025-11-25 18:41:11.123921
"Broccoli Man, Remastered",117,58,https://mbleigh.dev/posts/broccoli-man-remastered/,2025-11-25 18:41:11.226586
Nearby peer discovery without GPS using environmental fingerprints,52,17,https://www.svendewaerhert.com/blog/nearby-peer-discovery/,2025-11-25 18:41:11.324288
Brain has five 'eras' with adult mode not starting until early 30s,199,180,https://www.theguardian.com/science/2025/nov/25/brain-human-cognitive-development-life-stages-cambridge-study,2025-11-25 18:41:11.425894
APT Rust requirement raises questions,208,357,https://lwn.net/SubscriberLink/1046841/5bbf1fc049a18947/,2025-11-25 18:41:11.528614
PRC elites voice AI-skepticism,80,12,https://jamestown.org/prc-elites-voice-ai-skepticism/,2025-11-25 18:41:11.629769
Claude Advanced Tool Use,606,245,https://www.anthropic.com/engineering/advanced-tool-use,2025-11-25 18:41:11.730861
Orion 1.0,175,103,https://blog.kagi.com/orion,2025-11-25 18:41:11.825115
"Hollywood's vision of ancient Rome is all wrong, according to Mary Beard",50,51,https://www.openculture.com/2025/11/why-your-vision-of-ancient-rome-is-all-wrong-according-to-historian-mary-beard.html,2025-11-25 18:41:11.923404
Using an Array of Needles to Create Solid Knitted Shapes,66,19,https://dl.acm.org/doi/10.1145/3746059.3747759,2025-11-25 18:41:12.022525
Show HN: I built an interactive HN Simulator,456,202,https://news.ysimulator.run/news,2025-11-25 18:41:12.122408
Three Years from GPT-3 to Gemini 3,337,269,https://www.oneusefulthing.org/p/three-years-from-gpt-3-to-gemini,2025-11-25 18:41:12.220626
How the Atomic Tests Looked Like from Los Angeles,108,79,https://www.amusingplanet.com/2016/09/how-atomic-tests-looked-like-from-los.html,2025-11-25 18:41:12.325503
Pebble Watch software is now open source,1190,212,https://ericmigi.com/blog/pebble-watch-software-is-now-100percent-open-source,2025-11-25 18:41:12.417683
Reinventing how .NET builds and ships (again),84,32,https://devblogs.microsoft.com/dotnet/reinventing-how-dotnet-builds-and-ships-again/,2025-11-26 02:07:14.074312
A new bridge links the math of infinity to computer science,122,29,https://www.quantamagazine.org/a-new-bridge-links-the-strange-math-of-infinity-to-computer-science-20251121/,2025-11-26 02:07:14.179258
Unifying our mobile and desktop domains,100,20,https://techblog.wikimedia.org/2025/11/21/unifying-mobile-and-desktop-domains/,2025-11-26 02:07:14.285823
What they don't tell you about maintaining an open source project,68,48,https://andrej.sh/blog/maintaining-open-source-project/,2025-11-26 02:07:14.391732
"A DOOM vector engine for rendering in KiCad, and over an audio jack",63,6,https://www.mikeayles.com/#kidoom,2025-11-26 02:07:14.496896
"Show HN: We built an open source, zero webhooks payment processor",221,144,https://github.com/flowglad/flowglad,2025-11-26 02:07:14.603447
Google Antigravity exfiltrates data via indirect prompt injection attack,562,150,https://www.promptarmor.com/resources/google-antigravity-exfiltrates-data,2025-11-26 02:07:14.707301
LLVM Adds Constant-Time Support for Protecting Cryptographic Code,23,6,https://blog.trailofbits.com/2025/11/25/constant-time-support-lands-in-llvm-protecting-cryptographic-code-at-the-compiler-level/,2025-11-26 02:07:14.815071
How to repurpose your old phone into a web server,174,72,https://far.computer/how-to/,2025-11-26 02:07:14.920818
FLUX.2: Frontier Visual Intelligence,239,70,https://bfl.ai/blog/flux-2,2025-11-26 02:07:15.026301
The Definitive Classic Mac Pro (2006-2012) Upgrade Guide,7,1,https://blog.greggant.com/posts/2018/05/07/definitive-mac-pro-upgrade-guide.html,2025-11-26 02:07:15.130530
Trillions spent and big software projects are still failing,309,277,https://spectrum.ieee.org/it-management-software-failures,2025-11-26 02:07:15.239565
Jakarta is now the biggest city in the world,246,161,https://www.axios.com/2025/11/24/jakarta-tokyo-worlds-biggest-city-population,2025-11-26 02:07:15.319392
"Ironwood, our latest TPU",24,4,https://blog.google/products/google-cloud/ironwood-google-tpu-things-to-know/,2025-11-26 02:07:15.423416
Ilya Sutskever: We're moving from the age of scaling to the age of research,191,162,https://www.dwarkesh.com/p/ilya-sutskever-2,2025-11-26 02:07:15.530689
The Generative Burrito Test,80,40,https://www.generativist.com/notes/2025/Nov/25/generative-burrito-test.html,2025-11-26 02:07:15.638365
Launch HN: Onyx (YC W24) – Open-source chat UI,166,120,https://news.ycombinator.com/item?id=46045987,2025-11-26 02:07:15.727703
Notes on the Troubleshooting and Repair of Computer and Video Monitors,17,2,https://www.repairfaq.org/sam/monfaq.htm,2025-11-26 02:07:15.816969
Constant-time support coming to LLVM: Protecting cryptographic code,44,16,https://blog.trailofbits.com/2025/11/25/constant-time-support-coming-to-llvm-protecting-cryptographic-code-at-the-compiler-level/,2025-11-26 02:07:15.919053
"1,700-year-old Roman sarcophagus is unearthed in Budapest",20,9,https://apnews.com/article/hungary-roman-sarcophagus-discovery-budapest-77a41fe190bbcc167b43d05141536f54,2025-11-26 02:07:16.037517
CS234: Reinforcement Learning Winter 2025,5,0,https://web.stanford.edu/class/cs234/,2025-11-26 02:07:16.129079
Python is not a great language for data science,136,147,https://blog.genesmindsmachines.com/p/python-is-not-a-great-language-for,2025-11-26 02:07:16.236951
The 101 of analog signal filtering (2024),126,9,https://lcamtuf.substack.com/p/the-101-of-analog-signal-filtering,2025-11-26 02:07:16.313859
The gruesome new data on tech jobs,39,31,https://www.businessinsider.com/gruesome-tech-jobs-data-scientists-analytics-indeed-2025-11,2025-11-26 02:07:16.420637
Brand New Layouts with CSS Subgrid,4,1,https://www.joshwcomeau.com/css/subgrid/,2025-11-26 02:07:16.526214
What Now? Handling Errors in Large Systems,6,0,https://brooker.co.za/blog/2025/11/20/what-now,2025-11-26 02:07:16.635407
Inflatable Space Stations,65,26,https://worksinprogress.co/issue/inflatable-space-stations/,2025-11-26 02:07:16.727277
Unison 1.0,206,67,https://www.unison-lang.org/unison-1-0/,2025-11-26 02:07:16.840984
Someone at YouTube Needs Glasses: The Prophecy Has Been Fulfilled,307,214,https://jayd.ml/2025/11/10/someone-at-youtube-needs-glasses-prophecy-fulfilled.html,2025-11-26 02:07:16.947825
Making Crash Bandicoot (2011),204,36,https://all-things-andy-gavin.com/video-games/making-crash/,2025-11-26 02:07:17.042175
Show HN: KiDoom – Running DOOM on PCB Traces,169,19,https://www.mikeayles.com/#kidoom,2025-11-26 06:42:02.918563
"Surprisingly, Emacs on Android is pretty good",82,23,https://kristofferbalintona.me/posts/202505291438/,2025-11-26 06:42:03.051036
Space Truckin' – The Nostromo (2012),56,15,https://alienseries.wordpress.com/2012/10/23/space-truckin-the-nostromo/,2025-11-26 06:42:03.185501
Java Decompiler,37,9,http://java-decompiler.github.io,2025-11-26 06:42:03.325686
A new bridge links the math of infinity to computer science,158,57,https://www.quantamagazine.org/a-new-bridge-links-the-strange-math-of-infinity-to-computer-science-20251121/,2025-11-26 06:42:03.458690
New layouts with CSS Subgrid,141,31,https://www.joshwcomeau.com/css/subgrid/,2025-11-26 06:42:03.591635
"Show HN: We built an open source, zero webhooks payment processor",272,157,https://github.com/flowglad/flowglad,2025-11-26 06:42:03.722195
Trillions spent and big software projects are still failing,384,340,https://spectrum.ieee.org/it-management-software-failures,2025-11-26 06:42:03.855280
First Air-Breathing Spacecraft,8,6,https://rdw.com/newsroom/redwire-awarded-44-million-darpa-contract-to-advance-very-low-earth-orbit-mission/,2025-11-26 06:42:03.985195
CS234: Reinforcement Learning Winter 2025,62,7,https://web.stanford.edu/class/cs234/,2025-11-26 06:42:04.116730
FLUX.2: Frontier Visual Intelligence,276,81,https://bfl.ai/blog/flux-2,2025-11-26 06:42:04.250018
How to repurpose your old phone into a web server,205,76,https://far.computer/how-to/,2025-11-26 06:42:04.419557
Launch HN: Onyx (YC W24) – Open-source chat UI,183,132,https://news.ycombinator.com/item?id=46045987,2025-11-26 06:42:04.554930
The Bughouse Effect,25,5,https://tsvibt.blogspot.com/2025/11/the-bughouse-effect.html,2025-11-26 06:42:04.689346
"1,700-year-old Roman sarcophagus is unearthed in Budapest",43,22,https://apnews.com/article/hungary-roman-sarcophagus-discovery-budapest-77a41fe190bbcc167b43d05141536f54,2025-11-26 06:42:04.827143
Google Antigravity exfiltrates data via indirect prompt injection attack,622,169,https://www.promptarmor.com/resources/google-antigravity-exfiltrates-data,2025-11-26 06:42:04.957065
Marble Springs (1993),19,0,https://www.eastgate.com/MS/Title_184.html,2025-11-26 06:42:05.089196
"BebboSSH: SSH2 implementation for Amiga systems (68000, GPLv3)",19,2,https://franke.ms/git/bebbo/bebbossh,2025-11-26 06:42:05.219985
Ilya Sutskever: We're moving from the age of scaling to the age of research,259,209,https://www.dwarkesh.com/p/ilya-sutskever-2,2025-11-26 06:42:05.353924
The fall of Labubus and the mush of modern internet trends,74,90,https://www.michigandaily.com/arts/digital-culture/the-fall-of-labubus-and-the-mush-of-modern-internet-trends/,2025-11-26 06:42:05.483043
Unifying our mobile and desktop domains,128,36,https://techblog.wikimedia.org/2025/11/21/unifying-mobile-and-desktop-domains/,2025-11-26 06:42:05.611129
Show HN: A WordPress plugin that rewrites image URLs for near-zero-cost delivery,45,27,https://wordpress.org/plugins/bandwidth-saver/,2025-11-26 06:42:05.767485
Python is not a great language for data science,183,184,https://blog.genesmindsmachines.com/p/python-is-not-a-great-language-for,2025-11-26 06:42:05.904337
Someone at YouTube Needs Glasses: The Prophecy Has Been Fulfilled,480,352,https://jayd.ml/2025/11/10/someone-at-youtube-needs-glasses-prophecy-fulfilled.html,2025-11-26 06:42:06.038142
Reinventing how .NET builds and ships (again),147,54,https://devblogs.microsoft.com/dotnet/reinventing-how-dotnet-builds-and-ships-again/,2025-11-26 06:42:06.168341
Space: 1999 – Special Effects Techniques,29,5,https://catacombs.space1999.net/main/pguide/upsfx.html,2025-11-26 06:42:06.303420
Jakarta is now the biggest city in the world,292,215,https://www.axios.com/2025/11/24/jakarta-tokyo-worlds-biggest-city-population,2025-11-26 06:42:06.433437
Notes on the Troubleshooting and Repair of Computer and Video Monitors,33,8,https://www.repairfaq.org/sam/monfaq.htm,2025-11-26 06:42:06.564230
