Willis Whitfield: Creator of clean room technology still in use today (2024),134,50,https://www.sandia.gov/labnews/2024/04/04/willis-whitfield-a-simple-man-with-a-simple-solution-that-changed-the-world/,2025-11-27 18:37:44.590517
Gemini CLI Tips and Tricks for Agentic Coding,366,128,https://github.com/addyosmani/gemini-cli-tips,2025-11-27 18:37:44.700431
Protect Public School Students from Surveillance of Off-Campus Speech,39,11,https://www.eff.org/deeplinks/2025/11/eff-arizona-federal-court-protect-public-school-students-surveillance-and,2025-11-27 18:37:44.815492
S&box is now an open source game engine,388,133,https://sbox.game/news/update-25-11-26,2025-11-27 18:37:44.934805
Running Unsupported iOS on Deprecated Devices,199,98,https://nyansatan.github.io/run-unsupported-ios/,2025-11-27 18:37:45.046843
Coq: The World's Best Macro Assembler? (2013) [pdf],116,48,https://nickbenton.name/coqasm.pdf,2025-11-27 18:37:45.158298
How Charles M Schulz created Charlie Brown and Snoopy (2024),41,7,https://www.bbc.com/culture/article/20241205-how-charles-m-schulz-created-charlie-brown-and-snoopy,2025-11-28 02:04:03.360210
250MWh 'Sand Battery' to start construction in Finland,127,55,https://www.energy-storage.news/250mwh-sand-battery-to-start-construction-in-finland-for-both-heating-and-ancillary-services/,2025-11-28 02:04:03.491187
Same-day upstream Linux support for Snapdragon 8 Elite Gen 5,335,146,https://www.qualcomm.com/developer/blog/2025/10/same-day-snapdragon-8-elite-gen-5-upstream-linux-support,2025-11-28 02:04:03.604652
Vsora Jotunn-8 5nm European inference chip,31,8,https://vsora.com/products/jotunn-8/,2025-11-28 02:04:03.717462
Physicists drive antihydrogen breakthrough at CERN,122,31,https://phys.org/news/2025-11-physicists-antihydrogen-breakthrough-cern-technique.html,2025-11-28 02:04:03.832620
A programmer-friendly I/O abstraction over io_uring and kqueue (2022),33,6,https://tigerbeetle.com/blog/2022-11-23-a-friendly-abstraction-over-iouring-and-kqueue/,2025-11-28 02:04:03.948323
Underrated reasons to be thankful V,128,58,https://dynomight.net/thanks-5/,2025-11-28 02:04:04.065287
Quake Engine Indicators,192,41,https://fabiensanglard.net/quake_indicators/index.html,2025-11-28 02:04:04.178337
Memories of .us,116,32,https://computer.rip/2025-11-11-dot-us.html,2025-11-28 02:04:04.292755
Feedback doesn't scale,109,29,https://another.rodeo/feedback/,2025-11-28 02:04:04.415595
Linux Kernel Explorer,533,79,https://reverser.dev/linux-kernel-explorer,2025-11-28 02:04:04.529653
Tell HN: Happy Thanksgiving,520,128,https://news.ycombinator.com/item?id=46065955,2025-11-28 02:04:04.651465
DeepSeekMath-V2: Towards Self-Verifiable Mathematical Reasoning [pdf],113,22,https://github.com/deepseek-ai/DeepSeek-Math-V2/blob/main/DeepSeekMath_V2.pdf,2025-11-28 02:04:04.767114
"Bird flu viruses are resistant to fever, making them a major threat to humans",31,23,https://medicalxpress.com/news/2025-11-bird-flu-viruses-resistant-fever.html,2025-11-28 02:04:05.817434
"Indie, Alone, and Figuring It Out",31,2,https://danijelavrzan.com/posts/2025/11/indie-dev/,2025-11-28 02:04:06.225877
TPUs vs. GPUs and why Google is positioned to win AI race in the long term,263,204,https://www.uncoveralpha.com/p/the-chip-made-for-the-ai-inference,2025-11-28 02:04:06.660512
Why Strong Consistency?,80,55,https://brooker.co.za/blog/2025/11/18/consistency.html,2025-11-28 02:04:06.773691
Maxduino Review: Tape Cassette Emulator for Multiple Retro Computers,5,0,https://retrogamecoders.com/maxduino-review/,2025-11-28 02:04:07.044042
DIY NAS: 2026 Edition,396,254,https://blog.briancmoses.com/2025/11/diy-nas-2026-edition.html,2025-11-28 02:04:07.156764
Mixpanel Security Breach,207,107,https://mixpanel.com/blog/sms-security-incident/,2025-11-28 02:04:07.350273
"LinkedIn is loud, and corporate is hell",172,105,https://ramones.dev/posts/linkedin-is-loud/,2025-11-28 02:04:07.519217
"Inspired by Spider-Man, scientists recreate web-slinging technology",41,10,https://scienceclock.com/inspired-by-spider-man-scientists-recreate-web-slinging-technology/,2025-11-28 02:04:07.638346
Ray Marching Soft Shadows in 2D (2020),178,28,https://www.rykap.com/2020/09/23/distance-fields/,2025-11-28 02:04:07.758846
Coq: The World's Best Macro Assembler? (2013) [pdf],140,64,https://nickbenton.name/coqasm.pdf,2025-11-28 02:04:07.871064
"Music eases surgery and speeds recovery, study finds",198,88,https://www.bbc.com/news/articles/c231dv9zpz3o,2025-11-28 02:04:07.984381
The VanDersarl Blériot: a 1911 airplane homebuilt by teenage brothers (2017),40,34,https://www.historynet.com/vandersarl-bleriot/,2025-11-28 02:04:08.097307
The current state of the theory that GPL propagates to AI models,182,233,https://shujisado.org/2025/11/27/gpl-propagates-to-ai-models-trained-on-gpl-code/,2025-11-28 02:04:08.209547
Penpot: The Open-Source Figma,693,171,https://github.com/penpot/penpot,2025-11-28 02:04:08.326020
Show HN: Runprompt – run .prompt files from the command line,108,35,https://github.com/chr15m/runprompt,2025-11-28 02:04:08.441167
Interactive λ-Reduction,118,22,https://deltanets.org/,2025-11-28 02:04:08.552676
Pocketbase – open-source realtime back end in 1 file,86,33,https://pocketbase.io/,2025-11-28 06:42:00.350168
"TigerStyle: Coding philosophy focused on safety, performance, dev experience",24,12,https://tigerstyle.dev/,2025-11-28 06:42:00.444475
How Charles M Schulz created Charlie Brown and Snoopy (2024),113,41,https://www.bbc.com/culture/article/20241205-how-charles-m-schulz-created-charlie-brown-and-snoopy,2025-11-28 06:42:00.536834
Same-day upstream Linux support for Snapdragon 8 Elite Gen 5,381,185,https://www.qualcomm.com/developer/blog/2025/10/same-day-snapdragon-8-elite-gen-5-upstream-linux-support,2025-11-28 06:42:00.637151
Vsora Jotunn-8 5nm European inference chip,66,13,https://vsora.com/products/jotunn-8/,2025-11-28 06:42:00.735682
250MWh 'Sand Battery' to start construction in Finland,215,104,https://www.energy-storage.news/250mwh-sand-battery-to-start-construction-in-finland-for-both-heating-and-ancillary-services/,2025-11-28 06:42:00.832036
China's BEV Trucks and the End of Diesel's Dominance,76,42,https://cleantechnica.com/2025/11/26/chinas-bev-trucks-and-the-end-of-diesels-dominance/,2025-11-28 06:42:00.930373
Physicists drive antihydrogen breakthrough at CERN,166,45,https://phys.org/news/2025-11-physicists-antihydrogen-breakthrough-cern-technique.html,2025-11-28 06:42:01.026840
A programmer-friendly I/O abstraction over io_uring and kqueue (2022),61,19,https://tigerbeetle.com/blog/2022-11-23-a-friendly-abstraction-over-iouring-and-kqueue/,2025-11-28 06:42:01.121852
"Migrating to Positron, a next-generation data science IDE for Python and R",12,4,https://posit.co/blog/positron-migration-guides,2025-11-28 06:42:01.212819
Quake Engine Indicators,227,48,https://fabiensanglard.net/quake_indicators/index.html,2025-11-28 06:42:01.308911
Maxduino Review: Tape Cassette Emulator for Multiple Retro Computers,31,0,https://retrogamecoders.com/maxduino-review/,2025-11-28 06:42:01.406520
Feedback doesn't scale,145,54,https://another.rodeo/feedback/,2025-11-28 06:42:01.504872
Memories of .us,146,49,https://computer.rip/2025-11-11-dot-us.html,2025-11-28 06:42:01.599590
"Installing Java in 2025, and Version Managers",9,2,https://blog.hakanserce.com/post/version_managers/,2025-11-28 06:42:01.700720
GitLab discovers widespread NPM supply chain attack,101,41,https://about.gitlab.com/blog/gitlab-discovers-widespread-npm-supply-chain-attack/,2025-11-28 06:42:01.798328
"Indie, alone, and figuring it out",60,10,https://danijelavrzan.com/posts/2025/11/indie-dev/,2025-11-28 06:42:01.895427
Tell HN: Happy Thanksgiving,653,163,https://news.ycombinator.com/item?id=46065955,2025-11-28 06:42:01.990252
"Bird flu viruses are resistant to fever, making them a major threat to humans",104,82,https://medicalxpress.com/news/2025-11-bird-flu-viruses-resistant-fever.html,2025-11-28 06:42:02.095721
Experimenting with Robin Hood Hashing,8,2,https://twdev.blog/2025/11/robin_hood/,2025-11-28 06:42:02.190609
Giving the Jakks Atari Paddle a Spin,26,0,https://nicole.express/2025/paddle-me-atari.html,2025-11-28 06:42:02.292775
Underrated reasons to be thankful V,172,76,https://dynomight.net/thanks-5/,2025-11-28 06:42:02.388184
DeepSeekMath-V2: Towards Self-Verifiable Mathematical Reasoning [pdf],175,36,https://github.com/deepseek-ai/DeepSeek-Math-V2/blob/main/DeepSeekMath_V2.pdf,2025-11-28 06:42:02.484006
Implementing Bluetooth LE Audio and Auracast on Linux Systems,11,0,https://www.collabora.com/news-and-blog/blog/2025/11/24/implementing-bluetooth-le-audio-and-auracast-on-linux-systems/,2025-11-28 06:42:02.578052
DIY NAS: 2026 Edition,418,267,https://blog.briancmoses.com/2025/11/diy-nas-2026-edition.html,2025-11-28 06:42:02.674481
TPUs vs. GPUs and why Google is positioned to win AI race in the long term,333,245,https://www.uncoveralpha.com/p/the-chip-made-for-the-ai-inference,2025-11-28 06:42:02.775793
ML-KEM Mythbusting,20,3,https://keymaterial.net/2025/11/27/ml-kem-mythbusting/,2025-11-28 06:42:02.869661
Mixpanel Security Breach,228,109,https://mixpanel.com/blog/sms-security-incident/,2025-11-28 06:42:02.967254
Coq: The World's Best Macro Assembler? (2013) [pdf],153,67,https://nickbenton.name/coqasm.pdf,2025-11-28 06:42:03.070586
Ray Marching Soft Shadows in 2D (2020),185,29,https://www.rykap.com/2020/09/23/distance-fields/,2025-11-28 06:42:03.170621
The mysterious black fungus from Chernobyl that may eat radiation,20,0,https://www.bbc.com/future/article/20251125-the-mysterious-black-fungus-from-chernobyl-that-appears-to-eat-radiation,2025-11-28 12:56:34.618932
Show HN: Glasses to detect smart-glasses that have cameras,282,96,https://github.com/NullPxl/banrays,2025-11-28 12:56:34.737071
"EU Council Approves New ""Chat Control"" Mandate Pushing Mass Surveillance",279,140,https://reclaimthenet.org/eu-council-approves-new-chat-control-mandate-pushing-mass-surveillance,2025-11-28 12:56:34.846910
A Tale of Four Fuzzers,16,0,https://tigerbeetle.com/blog/2025-11-28-tale-of-four-fuzzers/,2025-11-28 12:56:34.958474
Pocketbase – open-source realtime back end in 1 file,371,120,https://pocketbase.io/,2025-11-28 12:56:35.072608
"Moss: a Rust Linux-compatible kernel in 26,000 lines of code",140,25,https://github.com/hexagonal-sun/moss,2025-11-28 12:56:35.182382
A Repository with 44 Years of Unix Evolution,28,5,https://www.spinellis.gr/pubs/conf/2015-MSR-Unix-History/html/Spi15c.html,2025-11-28 12:56:35.292578
How to make precise sheet metal parts (photochemical machining) [video],39,2,https://www.youtube.com/watch?v=bR9EN3kUlfg,2025-11-28 12:56:35.404072
The three thousand year journey of colchicine,6,1,https://www.worksinprogress.news/p/the-three-thousand-year-journey-of,2025-11-28 12:56:35.519502
Google denies 'misleading' reports of Gmail using your emails to train AI,43,31,https://www.theverge.com/news/826902/gmail-ai-training-data-opt-out,2025-11-28 12:56:35.631015
Same-day upstream Linux support for Snapdragon 8 Elite Gen 5,427,204,https://www.qualcomm.com/developer/blog/2025/10/same-day-snapdragon-8-elite-gen-5-upstream-linux-support,2025-11-28 12:56:35.741814
Vsora Jotunn-8 5nm European inference chip,134,40,https://vsora.com/products/jotunn-8/,2025-11-28 12:56:35.853215
Switzerland: Data Protection Officers Impose Broad Cloud Ban for Authorities,15,4,https://www.heise.de/en/news/Switzerland-Data-Protection-Officers-Impose-Broad-Cloud-Ban-for-Authorities-11093477.html,2025-11-28 12:56:35.966861
How Charles M Schulz created Charlie Brown and Snoopy (2024),145,62,https://www.bbc.com/culture/article/20241205-how-charles-m-schulz-created-charlie-brown-and-snoopy,2025-11-28 12:56:36.077918
How to use Linux vsock for fast VM communication,43,11,https://popovicu.com/posts/how-to-use-linux-vsock-for-fast-vm-communication/,2025-11-28 12:56:36.192759
Beads – A memory upgrade for your coding agent,58,30,https://github.com/steveyegge/beads,2025-11-28 12:56:36.304701
Implementing Bluetooth LE Audio and Auracast on Linux Systems,84,3,https://www.collabora.com/news-and-blog/blog/2025/11/24/implementing-bluetooth-le-audio-and-auracast-on-linux-systems/,2025-11-28 12:56:36.415521
Open (Apache 2.0) TTS model for streaming conversational audio in realtime,12,2,https://github.com/nari-labs/dia2,2025-11-28 12:56:36.527121
GitLab discovers widespread NPM supply chain attack,239,139,https://about.gitlab.com/blog/gitlab-discovers-widespread-npm-supply-chain-attack/,2025-11-28 12:56:36.643569
A Remarkable Assertion from A16Z,5,0,https://nealstephenson.substack.com/p/a-remarkable-assertion-from-a16z,2025-11-28 12:56:36.756809
Tech Titans Amass Multimillion-Dollar War Chests to Fight AI Regulation,42,39,https://www.wsj.com/tech/ai/tech-titans-amass-multimillion-dollar-war-chests-to-fight-ai-regulation-88c600e1,2025-11-28 12:56:36.870848
A programmer-friendly I/O abstraction over io_uring and kqueue (2022),98,28,https://tigerbeetle.com/blog/2022-11-23-a-friendly-abstraction-over-iouring-and-kqueue/,2025-11-28 12:56:36.982310
Quake Engine Indicators,276,54,https://fabiensanglard.net/quake_indicators/index.html,2025-11-28 12:56:37.097544
Physicists drive antihydrogen breakthrough at CERN,200,74,https://phys.org/news/2025-11-physicists-antihydrogen-breakthrough-cern-technique.html,2025-11-28 12:56:37.210919
250MWh 'Sand Battery' to start construction in Finland,284,204,https://www.energy-storage.news/250mwh-sand-battery-to-start-construction-in-finland-for-both-heating-and-ancillary-services/,2025-11-28 12:56:37.320030
"Migrating to Positron, a next-generation data science IDE for Python and R",40,36,https://posit.co/blog/positron-migration-guides,2025-11-28 12:56:37.433671
Shor's algorithm: the one quantum algo that ends RSA/ECC tomorrow,28,15,https://blog.ellipticc.com/posts/what-is-shors-algorithm-and-why-its-the-single-biggest-threat-to-classical-cryptography/,2025-11-28 12:56:37.548522
Tell HN: Happy Thanksgiving,745,185,https://news.ycombinator.com/item?id=46065955,2025-11-28 12:56:37.661410
Feedback doesn't scale,185,71,https://another.rodeo/feedback/,2025-11-28 12:56:37.774667
Africa's forests have switched from absorbing to emitting carbon,20,5,https://phys.org/news/2025-11-africa-forests-absorbing-emitting-carbon.html,2025-11-28 12:56:37.894440
28M Hacker News comments as vector embedding search dataset,35,6,https://clickhouse.com/docs/getting-started/example-datasets/hackernews-vector-search-dataset,2025-11-28 18:37:51.498658
"Imgur Geo-Blocked the UK, So I Geo-Unblocked My Network",24,3,https://blog.tymscar.com/posts/imgurukproxy/,2025-11-28 18:37:51.609451
So you wanna build a local RAG?,51,8,https://blog.yakkomajuri.com/blog/local-rag,2025-11-28 18:37:51.721640
C++ Web Server on my custom hobby OS,30,3,https://oshub.org/projects/retros-32/posts/getting-a-webserver-running,2025-11-28 18:37:51.834986
Bringing Sexy Back. Internet surveillance has killed eroticism,106,41,https://lux-magazine.com/article/privacy-eroticism/,2025-11-28 18:37:51.946494
"Don't tug on that, you never know what it might be attached to (2016)",59,14,https://blog.plover.com/2016/07/01/#tmpdir,2025-11-28 18:37:52.062239
Can Dutch universities do without Microsoft?,136,111,https://dub.uu.nl/en/news/can-dutch-universities-do-without-microsoft,2025-11-28 18:37:52.176012
"JSON Schema Demystified: Dialects, Vocabularies and Metaschemas",17,1,https://www.iankduncan.com/engineering/2025-11-24-json-schema-demystified/,2025-11-28 18:37:52.293051
True P2P Email on Top of Yggdrasil Network,47,8,https://github.com/JB-SelfCompany/Tyr,2025-11-28 18:37:52.411077
Meta hiding $27B in debt using advanced geometry,191,89,https://stohl.substack.com/p/exclusive-credit-report-shows-meta,2025-11-28 18:37:52.531573
Atuin’s New Runbook Execution Engine,70,8,https://blog.atuin.sh/introducing-the-new-runbook-execution-engine/,2025-11-28 18:37:52.645610
Show HN: An LLM-Powered Tool to Catch PCB Schematic Mistakes,13,7,https://netlist.io/,2025-11-28 18:37:52.760650
Show HN: Glasses to detect smart-glasses that have cameras,422,154,https://github.com/NullPxl/banrays,2025-11-28 18:37:52.875183
Lobsters Interview,9,1,https://susam.net/my-lobsters-interview.html,2025-11-28 18:37:52.990864
AI Adoption Rates Starting to Flatten Out,97,45,https://www.apolloacademy.com/ai-adoption-rates-starting-to-flatten-out/,2025-11-28 18:37:53.104332
Tech Titans Amass Multimillion-Dollar War Chests to Fight AI Regulation,154,155,https://www.wsj.com/tech/ai/tech-titans-amass-multimillion-dollar-war-chests-to-fight-ai-regulation-88c600e1,2025-11-28 18:37:53.215564
Analog Hoverboard Controller,6,0,https://github.com/skrubis/analog-hoverboard,2025-11-28 18:37:53.329200
"Moss: a Rust Linux-compatible kernel in 26,000 lines of code",316,81,https://github.com/hexagonal-sun/moss,2025-11-28 18:37:53.442053
Petition to formally recognize open source work as civic service in Germany,373,96,https://www.openpetition.de/petition/online/anerkennung-von-open-source-arbeit-als-ehrenamt-in-deutschland#petition-main,2025-11-28 18:37:53.552599
Anti-patterns while working with LLMs,7,0,https://instavm.io/blog/llm-anti-patterns,2025-11-28 18:37:53.670616
Pocketbase – open-source realtime back end in 1 file,564,157,https://pocketbase.io/,2025-11-28 18:37:53.785783
Stellantis Is Spamming Owners' Screens with Pop-Up Ads for New Car Discounts,66,27,https://www.thedrive.com/news/stellantis-is-spamming-owners-screens-with-pop-up-ads-for-new-car-discounts,2025-11-28 18:37:53.901076
Apple and Intel Rumored to Partner on Mac Chips,52,25,https://www.macrumors.com/2025/11/28/intel-rumored-to-supply-new-mac-chip/,2025-11-28 18:37:54.021397
Rock Paper Scissors Solitaire,5,1,https://klezlab.it/rock-paper-scissors-solitaire.html,2025-11-28 18:37:54.135777
Airloom – 3D Flight Tracker,14,1,https://objectiveunclear.com/airloom.html,2025-11-28 18:37:54.246090
Generating 3D Meshes from Text,14,1,https://cprimozic.net/notes/posts/generating-3d-meshes-from-text/,2025-11-28 18:37:54.359488
A Tale of Four Fuzzers,48,14,https://tigerbeetle.com/blog/2025-11-28-tale-of-four-fuzzers/,2025-11-28 18:37:54.474816
A Remarkable Assertion from A16Z,260,103,https://nealstephenson.substack.com/p/a-remarkable-assertion-from-a16z,2025-11-28 18:37:54.592495
Poll HN: What operating system do you primarily develop on?,50,68,https://news.ycombinator.com/item?id=46081063,2025-11-28 18:37:54.707363
Swedish publishers file police report against Meta's Zuckerberg for fraud,82,25,https://www.sverigesradio.se/artikel/swedish-publishers-file-police-report-against-metas-zuckerberg-for-fraud,2025-11-28 18:37:54.827727
A triangle whose interior angles sum to zero,28,9,https://www.johndcook.com/blog/2025/11/28/tricusp-triangle/,2025-11-29 02:03:56.288038
Airbus A320 – intense solar radiation may corrupt data critical for flight,81,5,https://www.airbus.com/en/newsroom/press-releases/2025-11-airbus-update-on-a320-family-precautionary-fleet-action,2025-11-29 02:03:56.402971
"Imgur geo-blocked the UK, so I geo-unblocked my network",272,98,https://blog.tymscar.com/posts/imgurukproxy/,2025-11-29 02:03:56.521590
Molly: An Improved Signal App,230,120,https://molly.im/,2025-11-29 02:03:56.634402
Confessions of a Software Developer: No More Self-Censorship,93,98,https://kerrick.blog/articles/2025/confessions-of-a-software-developer-no-more-self-censorship/,2025-11-29 02:03:56.747914
How good engineers write bad code at big companies,233,144,https://www.seangoedecke.com/bad-code-at-big-companies/,2025-11-29 02:03:56.906296
So you wanna build a local RAG?,203,37,https://blog.yakkomajuri.com/blog/local-rag,2025-11-29 02:03:57.024174
"The original ABC language, Python's predecessor (1991)",74,13,https://github.com/gvanrossum/abc-unix,2025-11-29 02:03:57.141328
A first look at Django's new background tasks,60,10,https://roam.be/notes/2025/a-first-look-at-djangos-new-background-tasks/,2025-11-29 02:03:57.257833
Airloom – 3D Flight Tracker,152,40,https://objectiveunclear.com/airloom.html,2025-11-29 02:03:57.370378
28M Hacker News comments as vector embedding search dataset,320,131,https://clickhouse.com/docs/getting-started/example-datasets/hackernews-vector-search-dataset,2025-11-29 02:03:57.483209
Flight disruption warning as Airbus requests modifications to 6k planes,155,61,https://www.bbc.com/news/live/cvg4y6g74ert,2025-11-29 02:03:57.596294
"I mathematically proved the best ""Guess Who?"" strategy [video]",35,7,https://www.youtube.com/watch?v=_3RNB8eOSx0,2025-11-29 02:03:57.709097
Effective harnesses for long-running agents,71,19,https://www.anthropic.com/engineering/effective-harnesses-for-long-running-agents,2025-11-29 02:03:57.820919
Fabric Project,23,1,https://github.com/Fabric-Project/Fabric,2025-11-29 02:03:57.934128
How to Short the Bubbliest Firms,25,30,https://www.economist.com/finance-and-economics/2025/11/26/how-to-short-the-bubbliest-firms,2025-11-29 02:03:58.047672
AltSendme: Another Alternative to MAgic Wormhole?,9,3,https://github.com/tonyantony300/alt-sendme,2025-11-29 02:03:58.165465
"Don't tug on that, you never know what it might be attached to (2016)",102,38,https://blog.plover.com/2016/07/01/#tmpdir,2025-11-29 02:03:58.280945
True P2P Email on Top of Yggdrasil Network,106,21,https://github.com/JB-SelfCompany/Tyr,2025-11-29 02:03:58.394051
Can Dutch universities do without Microsoft?,253,245,https://dub.uu.nl/en/news/can-dutch-universities-do-without-microsoft,2025-11-29 02:03:58.505925
C++ Web Server on my custom hobby OS,86,11,https://oshub.org/projects/retros-32/posts/getting-a-webserver-running,2025-11-29 02:03:58.617579
Show HN: Pulse 2.0 – Live co-listening rooms where anyone can be a DJ,57,21,https://473999.net/pulse,2025-11-29 02:03:58.731357
"JSON Schema Demystified: Dialects, Vocabularies and Metaschemas",49,22,https://www.iankduncan.com/engineering/2025-11-24-json-schema-demystified/,2025-11-29 02:03:58.844817
Space: 1999 – Special Effects Techniques,47,20,https://catacombs.space1999.net/main/pguide/upsfx.html,2025-11-29 02:03:58.959214
Bringing Sexy Back. Internet surveillance has killed eroticism,305,202,https://lux-magazine.com/article/privacy-eroticism/,2025-11-29 02:03:59.075336
Atuin’s New Runbook Execution Engine,110,22,https://blog.atuin.sh/introducing-the-new-runbook-execution-engine/,2025-11-29 02:03:59.188382
Show HN: An LLM-Powered Tool to Catch PCB Schematic Mistakes,35,21,https://netlist.io/,2025-11-29 02:03:59.300206
Lobsters Interview,73,50,https://susam.net/my-lobsters-interview.html,2025-11-29 02:03:59.412837
Credit report shows Meta keeping $27B off its books through advanced geometry,352,184,https://stohl.substack.com/p/exclusive-credit-report-shows-meta,2025-11-29 02:03:59.526745
Electron vs. Tauri,21,8,https://www.dolthub.com/blog/2025-11-13-electron-vs-tauri/,2025-11-29 02:03:59.641568
System 7 natively boots on the Mac mini G4,103,16,https://macos9lives.com/smforum/index.php?topic=7711.0,2025-11-29 06:38:44.639381
Airbus A320 – intense solar radiation may corrupt data critical for flight,217,42,https://www.airbus.com/en/newsroom/press-releases/2025-11-airbus-update-on-a320-family-precautionary-fleet-action,2025-11-29 06:38:44.693332
WinApps: Run Windows apps as if they were a part of the native Linux OS,39,5,https://github.com/winapps-org/winapps,2025-11-29 06:38:44.746753
"Imgur geo-blocked the UK, so I geo-unblocked my network",339,114,https://blog.tymscar.com/posts/imgurukproxy/,2025-11-29 06:38:44.802872
A triangle whose interior angles sum to zero,83,38,https://www.johndcook.com/blog/2025/11/28/tricusp-triangle/,2025-11-29 06:38:44.855962
Molly: An Improved Signal App,291,156,https://molly.im/,2025-11-29 06:38:44.912329
Every mathematician has only a few tricks (2020),50,11,https://mathoverflow.net/questions/363119/every-mathematician-has-only-a-few-tricks,2025-11-29 06:38:44.967100
Confessions of a Software Developer: No More Self-Censorship,159,157,https://kerrick.blog/articles/2025/confessions-of-a-software-developer-no-more-self-censorship/,2025-11-29 06:38:45.020236
So you wanna build a local RAG?,254,50,https://blog.yakkomajuri.com/blog/local-rag,2025-11-29 06:38:45.076410
Show HN: Mu – The Micro Network,16,4,https://github.com/asim/mu,2025-11-29 06:38:45.130575
Airloom – 3D Flight Tracker,201,62,https://objectiveunclear.com/airloom.html,2025-11-29 06:38:45.188281
"The original ABC language, Python's predecessor (1991)",94,24,https://github.com/gvanrossum/abc-unix,2025-11-29 06:38:45.245584
A first look at Django's new background tasks,92,17,https://roam.be/notes/2025/a-first-look-at-djangos-new-background-tasks/,2025-11-29 06:38:45.302685
28M Hacker News comments as vector embedding search dataset,364,144,https://clickhouse.com/docs/getting-started/example-datasets/hackernews-vector-search-dataset,2025-11-29 06:38:45.355700
"I mathematically proved the best ""Guess Who?"" strategy [video]",55,14,https://www.youtube.com/watch?v=_3RNB8eOSx0,2025-11-29 06:38:45.417557
Neato vacuum robots to stop working,17,7,https://support.neatorobotics.com/support/solutions/articles/204000073686-announcement-6th-oct-2025,2025-11-29 06:38:45.470241
Fabric Project,41,6,https://github.com/Fabric-Project/Fabric,2025-11-29 06:38:45.524939
How good engineers write bad code at big companies,290,197,https://www.seangoedecke.com/bad-code-at-big-companies/,2025-11-29 06:38:45.581196
Language is primarily a tool for communication rather than thought (2024) [pdf],28,7,https://gwern.net/doc/psychology/linguistics/2024-fedorenko.pdf,2025-11-29 06:38:45.636027
Effective harnesses for long-running agents,91,32,https://www.anthropic.com/engineering/effective-harnesses-for-long-running-agents,2025-11-29 06:38:45.690896
Flight disruption warning as Airbus requests modifications to 6k planes,195,81,https://www.bbc.com/news/live/cvg4y6g74ert,2025-11-29 06:38:45.745042
"Don't tug on that, you never know what it might be attached to (2016)",117,53,https://blog.plover.com/2016/07/01/#tmpdir,2025-11-29 06:38:45.801943
