title,upvotes,comments,link,author,post_time,scraped_at,subreddit
"Will there be an AI apocalypse? I’m Eric Levitz, a senior correspondent at Vox, covering a wide range of political and policy issues. AMA on Friday, November 7, at 12 pm EST.",28,66,https://www.reddit.com/r/technology/comments/1opghaq/will_there_be_an_ai_apocalypse_im_eric_levitz_a/,vox,2025-11-05 21:53:07,2025-11-21 12:49:14.458778,technology
Microsoft AI CEO puzzled that people are unimpressed by AI,19175,2093,https://www.reddit.com/r/technology/comments/1p2osv5/microsoft_ai_ceo_puzzled_that_people_are/,Moth_LovesLamp,2025-11-21 04:03:30,2025-11-21 12:49:14.458784,technology
"Gmail can read your emails and attachments to train its AI, unless you opt out",1651,99,https://www.reddit.com/r/technology/comments/1p2vfdh/gmail_can_read_your_emails_and_attachments_to/,thatirishguyyyyy,2025-11-21 10:42:39,2025-11-21 12:49:14.458787,technology
The crypto market has seen $1 trillion in value erased in this month's plunge into bear territory,4479,341,https://www.reddit.com/r/technology/comments/1p2nbgq/the_crypto_market_has_seen_1_trillion_in_value/,Logical_Welder3467,2025-11-21 02:55:46,2025-11-21 12:49:14.458789,technology
OnlyFans Will Start Checking Criminal Records. Creators Say That's a Terrible Idea,1510,186,https://www.reddit.com/r/technology/comments/1p2pghx/onlyfans_will_start_checking_criminal_records/,FervidBug42,2025-11-21 04:37:55,2025-11-21 12:49:14.458792,technology
ICE Says Critical Evidence In Abuse Case Was Lost In 'System Crash' a Day After It Was Sued,436,35,https://www.reddit.com/r/technology/comments/1p2uqv4/ice_says_critical_evidence_in_abuse_case_was_lost/,rezwenn,2025-11-21 10:00:58,2025-11-21 12:49:14.458795,technology
"Verizon is laying off over 13,000 workers",4038,305,https://www.reddit.com/r/technology/comments/1p2fzoq/verizon_is_laying_off_over_13000_workers/,intelw1zard,2025-11-20 21:39:47,2025-11-21 12:49:14.458797,technology
SoftBank plunges over 10% as Asia markets track Wall Street’s stunning reversal in AI stocks,914,92,https://www.reddit.com/r/technology/comments/1p2mrz6/softbank_plunges_over_10_as_asia_markets_track/,Logical_Welder3467,2025-11-21 02:30:26,2025-11-21 12:49:14.458799,technology
Ukraine Is Jamming Russia’s ‘Superweapon’ With a Song,5196,197,https://www.reddit.com/r/technology/comments/1p27m77/ukraine_is_jamming_russias_superweapon_with_a_song/,CackleRooster,2025-11-20 16:27:42,2025-11-21 12:49:14.458802,technology
CDC website changed to include false claims that link autism and vaccines,3454,134,https://www.reddit.com/r/technology/comments/1p28kxb/cdc_website_changed_to_include_false_claims_that/,esporx,2025-11-20 17:03:48,2025-11-21 12:49:14.458804,technology
"Legendary game designer, programmer, Space Invaders champion, and LGBTQ trailblazer Rebecca Heineman has died | Heineman's cancer fundraiser is now collecting for her funeral.",3031,79,https://www.reddit.com/r/technology/comments/1p29lnt/legendary_game_designer_programmer_space_invaders/,ControlCAD,2025-11-20 17:42:09,2025-11-21 12:49:14.458807,technology
"First it was GPUs and electricity, now AI is eating up the memory industry",9195,519,https://www.reddit.com/r/technology/comments/1p1zubz/first_it_was_gpus_and_electricity_now_ai_is/,HellYeahDamnWrite,2025-11-20 10:32:38,2025-11-21 12:49:14.458809,technology
"DoorDash says personal information of customers, dashers stolen in data breach",1740,117,https://www.reddit.com/r/technology/comments/1p2a0mb/doordash_says_personal_information_of_customers/,lurker_bee,2025-11-20 17:57:45,2025-11-21 12:49:14.458813,technology
HP and Dell disable HEVC support built into their laptops’ CPUs | HEVC licensing gets more expensive in January 2026.,426,91,https://www.reddit.com/r/technology/comments/1p2l4nr/hp_and_dell_disable_hevc_support_built_into_their/,ControlCAD,2025-11-21 01:13:48,2025-11-21 12:49:14.458815,technology
Border Patrol is monitoring US drivers and detaining those with ‘suspicious’ travel patterns,2626,230,https://www.reddit.com/r/technology/comments/1p259vg/border_patrol_is_monitoring_us_drivers_and/,binding_swamp,2025-11-20 14:57:45,2025-11-21 12:49:14.458818,technology
Solving Fizz Buzz with Cosines,50,7,https://www.reddit.com/r/programming/comments/1p2su50/solving_fizz_buzz_with_cosines/,p-orbitals,2025-11-21 07:57:58,2025-11-21 12:49:20.161891,programming
A Technical Insight About Modern Compilation,4,0,https://www.reddit.com/r/programming/comments/1p2x8ex/a_technical_insight_about_modern_compilation/,Prize-Tomorrow-5249,2025-11-21 12:23:36,2025-11-21 12:49:20.161894,programming
The EU wants to kill cookiebanners by moving consent to your browser,783,172,https://www.reddit.com/r/programming/comments/1p1vtsz/the_eu_wants_to_kill_cookiebanners_by_moving/,DonutAccomplished422,2025-11-20 06:14:07,2025-11-21 12:49:20.161897,programming
How A Missing Last Name Check Left Millions of Airline Customers' Data Exposed,88,6,https://www.reddit.com/r/programming/comments/1p27hck/how_a_missing_last_name_check_left_millions_of/,bearsyankees,2025-11-20 16:22:46,2025-11-21 12:49:20.161899,programming
Arconia for Spring Boot Dev Services and Observability - Piotr's TechBlog,3,0,https://www.reddit.com/r/programming/comments/1p2um3t/arconia_for_spring_boot_dev_services_and/,piotr_minkowski,2025-11-21 09:52:55,2025-11-21 12:49:20.161902,programming
Pareto principle: 20% of your code causes 80% of your bugs (Microsoft found 1% caused 99% of crashes),140,22,https://www.reddit.com/r/programming/comments/1p21ty7/pareto_principle_20_of_your_code_causes_80_of/,dmp0x7c5,2025-11-20 12:25:41,2025-11-21 12:49:20.161904,programming
"Preserving code that shaped generations: Zork I, II, and III go Open Source",43,11,https://www.reddit.com/r/programming/comments/1p2b8pe/preserving_code_that_shaped_generations_zork_i_ii/,jfedor,2025-11-20 18:41:20,2025-11-21 12:49:20.161906,programming
"Linus Torvalds: Vibe coding is fine, but not for production",2425,347,https://www.reddit.com/r/programming/comments/1p1g9ni/linus_torvalds_vibe_coding_is_fine_but_not_for/,fungussa,2025-11-19 18:52:41,2025-11-21 12:49:20.161909,programming
Abuse of the nullish coalescing operator in JS/TS,1,0,https://www.reddit.com/r/programming/comments/1p2xcof/abuse_of_the_nullish_coalescing_operator_in_jsts/,fredrikaugust,2025-11-21 12:29:45,2025-11-21 12:49:20.161911,programming
Zyn 0.2.0 – An extensible pub/sub messaging protocol for real-time apps,0,1,https://www.reddit.com/r/programming/comments/1p2v19k/zyn_020_an_extensible_pubsub_messaging_protocol/,ortuman84,2025-11-21 10:18:13,2025-11-21 12:49:20.161914,programming
"Cursor's President is loving this University of Chicago study, but does merge rate really = productivity?",26,21,https://www.reddit.com/r/programming/comments/1p26wku/cursors_president_is_loving_this_university_of/,scarey102,2025-11-20 16:01:25,2025-11-21 12:49:20.161916,programming
Extension for LeetCode,0,0,https://www.reddit.com/r/programming/comments/1p2uv8f/extension_for_leetcode/,RK9_2006,2025-11-21 10:08:07,2025-11-21 12:49:20.161919,programming
What Killed Perl?,90,155,https://www.reddit.com/r/programming/comments/1p1yjb4/what_killed_perl/,Xaneris47,2025-11-20 09:08:40,2025-11-21 12:49:20.161921,programming
gis and sam 2,1,0,https://www.reddit.com/r/programming/comments/1p2twwk/gis_and_sam_2/,panspective,2025-11-21 09:07:20,2025-11-21 12:49:20.161923,programming
Providing an easy off-ramp to a vulnerable npm package (elliptic),7,1,https://www.reddit.com/r/programming/comments/1p2fo63/providing_an_easy_offramp_to_a_vulnerable_npm/,Soatok,2025-11-20 21:27:43,2025-11-21 12:49:20.161926,programming
