title,upvotes,comments,link,post_time,platform
Advent of Code 2025,87,35,https://adventofcode.com/2025/about,2025-11-30 14:35:08,hacker_news
CachyOS: Fast and Customizable Linux Distribution,126,117,https://cachyos.org/,2025-11-30 14:35:10,hacker_news
Show HN: Boing,504,92,https://boing.greg.technology/,2025-11-30 14:35:10,hacker_news
"Norway wealth fund to vote for human rights report at Microsoft, against Nadella",49,23,https://www.cnbc.com/2025/11/30/norway-wealth-fund-to-vote-for-human-rights-report-at-microsoft-agm-against-management.html,2025-11-30 14:35:11,hacker_news
Show HN: Real-time system that tracks how news spreads across 200k websites,90,25,https://yandori.io/news-flow/,2025-11-30 14:35:11,hacker_news
Zigbook Is Plagiarizing the Zigtools Playground,357,94,https://zigtools.org/blog/zigbook-plagiarizing-playground/,2025-11-30 14:35:11,hacker_news
RL is more information inefficient than you thought,56,16,https://www.dwarkesh.com/p/bits-per-sample,2025-11-30 14:35:12,hacker_news
All it takes is for one to work out,620,282,https://alearningaday.blog/2025/11/28/all-it-takes-is-for-one-to-work-out-2/,2025-11-30 14:35:12,hacker_news
Windows drive letters are not limited to A-Z,5,0,https://www.ryanliptak.com/blog/windows-drive-letters-are-not-limited-to-a-z/,2025-11-30 14:35:13,hacker_news
Paul Hegarty's updated CS193p SwiftUI course released by Stanford,15,1,https://cs193p.stanford.edu/,2025-11-30 14:35:13,hacker_news
The space of minds,29,12,https://karpathy.bearblog.dev/the-space-of-minds/,2025-11-30 14:35:14,hacker_news
What's Hiding Inside Haribo's Power Bank and Headphones?,76,25,https://www.lumafield.com/first-article/posts/whats-hiding-inside-haribos-power-bank-and-headphones,2025-11-30 14:35:14,hacker_news
Landlock-Ing Linux,233,90,https://blog.prizrak.me/post/landlock/,2025-11-30 14:35:15,hacker_news
Meshtastic,218,41,https://meshtastic.org/,2025-11-30 14:35:15,hacker_news
The HTTP Query Method,218,97,https://www.ietf.org/archive/id/draft-ietf-httpbis-safe-method-w-body-14.html,2025-11-30 14:35:16,hacker_news
Datacenters in space aren't going to work,372,302,https://taranis.ie/datacenters-in-space-are-a-terrible-horrible-no-good-idea/,2025-11-30 14:35:16,hacker_news
Learning Feynman's Trick for Integrals,226,30,https://zackyzz.github.io/feynman.html,2025-11-30 14:35:17,hacker_news
Jiga (YC W21) Is Hiring Product Designer,1,0,https://www.ycombinator.com/companies/jiga/jobs/Cco7vyK-product-designer-remote-europe,2025-11-30 14:35:17,hacker_news
Americans no longer see four-year college degrees as worth the cost,355,535,https://www.nbcnews.com/politics/politics-news/poll-dramatic-shift-americans-no-longer-see-four-year-college-degrees-rcna243672,2025-11-30 14:35:17,hacker_news
A new Little Prince museum has opened its doors in Switzerland,81,49,https://www.lepetitprince.com/en/events-around-the-world/a-new-little-prince-museum-has-opened-its-doors-in-switzerland/,2025-11-30 14:35:18,hacker_news
Blender facial animation tool. What else should it do?,105,13,https://github.com/shun126/livelinkface_arkit_receiver/wiki,2025-11-30 14:35:18,hacker_news
Leak confirms OpenAI is preparing ads on ChatGPT for public roll out,742,662,https://www.bleepingcomputer.com/news/artificial-intelligence/leak-confirms-openai-is-preparing-ads-on-chatgpt-for-public-roll-out/,2025-11-30 14:35:19,hacker_news
Advice for crime analyst to break into data science,15,0,https://andrewpwheeler.com/2025/11/21/advice-for-crime-analyst-to-break-into-data-science/,2025-11-30 14:35:19,hacker_news
Our Phosphorescent World,31,1,https://aeon.co/essays/the-cycling-of-phosphorus-is-the-basis-for-all-life-on-earth,2025-11-30 14:35:20,hacker_news
Anthony Bourdain's Lost Li.st's,297,89,https://bourdain.greg.technology/,2025-11-30 14:35:20,hacker_news
Don't throw away your old PC–it makes a better NAS than anything you can buy,4,0,https://www.howtogeek.com/turned-old-windows-pc-into-inexpensive-nas/,2025-11-30 14:35:21,hacker_news
Migrating Dillo from GitHub,31,12,https://dillo-browser.org/news/migration-from-github/,2025-11-30 15:02:34,hacker_news
The Easiest Way to Build a Type Checker,7,0,https://jimmyhmiller.com/easiest-way-to-build-type-checker,2025-11-30 15:02:36,hacker_news
Geothermal Breakthrough in South Texas Signals New Era for Ercot,5,0,https://www.powermag.com/geothermal-breakthrough-in-south-texas-signals-new-era-for-ercot/,2025-11-30 15:02:36,hacker_news
LLVM-MOS – Clang LLVM fork targeting the 6502,33,2,https://llvm-mos.org/wiki/Welcome,2025-11-30 18:36:50,hacker_news
The Thinking Game Film – Google DeepMind Documentary,86,48,https://thinkinggamefilm.com,2025-11-30 18:36:51,hacker_news
"ETH-Zurich: Digital Design and Computer Architecture; 227-0003-10L, Spring, 2025",19,0,https://safari.ethz.ch/ddca/spring2025/doku.php?id=start,2025-11-30 18:36:51,hacker_news
There is No Quintic Formula [video],4,1,https://www.youtube.com/watch?v=9HIy5dJE-zQ,2025-11-30 18:36:51,hacker_news
RetailReady (YC W24) Is Hiring Associate Product Manager,1,0,https://www.ycombinator.com/companies/retailready/jobs/KPKDu3D-associate-product-manager,2025-11-30 18:36:51,hacker_news
ESA Sentinel-1D delivers first high-resolution images,7,0,https://www.esa.int/Applications/Observing_the_Earth/Copernicus/Sentinel-1/Sentinel-1D_delivers_first_images_from_Antarctica_to_Bremen,2025-11-30 18:36:51,hacker_news
Show HN: Fixing Google Nano Banana Pixel Art with Rust,47,9,https://github.com/Hugo-Dz/spritefusion-pixel-snapper,2025-11-30 18:36:51,hacker_news
Don't push AI down our throats,18,2,https://gpt3experiments.substack.com/p/dont-push-ai-down-our-throats,2025-11-30 18:36:51,hacker_news
Langjam Gamejam: Build a programming language then make a game with it,10,5,https://langjamgamejam.com/,2025-11-30 18:36:51,hacker_news
I Made a Quieter Air Purifier,23,9,https://chillphysicsenjoyer.substack.com/p/i-made-a-quieter-air-purifier,2025-11-30 18:36:52,hacker_news
"In Re: 23andMe, Inc. Customer Data Security Breach Litigation",41,15,https://www.23andmedatasettlement.com/,2025-12-01 02:32:54,hacker_news
A Love Letter to FreeBSD,184,106,https://www.tara.sh/posts/2025/2025-11-25_freebsd_letter/,2025-12-01 02:32:54,hacker_news
Algorithms for Optimization [pdf],83,5,https://algorithmsbook.com/optimization/files/optimization.pdf,2025-12-01 02:32:54,hacker_news
Grokipedia Is the Antithesis of Wikipedia,58,35,https://www.404media.co/grokipedia-is-the-antithesis-of-everything-that-makes-wikipedia-good-useful-and-human/,2025-12-01 02:32:54,hacker_news
Writing a good Claude.md,330,105,https://www.humanlayer.dev/blog/writing-a-good-claude-md,2025-12-01 02:32:54,hacker_news
Advent of Sysadmin 2025,34,8,https://sadservers.com/advent,2025-12-01 02:32:54,hacker_news
Bricklink suspends Marketplace operations in 35 countries,69,25,https://jaysbrickblog.com/news/bricklink-suspends-marketplace-operations-in-35-countries/,2025-12-01 02:32:55,hacker_news
GitHub to Codeberg: my experience,152,66,https://eldred.fr/blog/forge-migration/,2025-12-01 02:32:55,hacker_news
Program-of-Thought Prompting Outperforms Chain-of-Thought by 15% (2022),74,21,https://arxiv.org/abs/2211.12588,2025-12-01 02:32:55,hacker_news
Mike Gordon and Hardware Verification,5,0,https://lawrencecpaulson.github.io/2023/01/04/Hardware_Verification.html,2025-12-01 02:32:55,hacker_news
The Thinking Game Film – Google DeepMind documentary,149,108,https://thinkinggamefilm.com,2025-12-01 02:32:56,hacker_news
Boobs check – Technique to verify if sites behind CDN are hosted in Iran,219,72,https://twitter.com/hkashfi/status/1995109785679573167,2025-12-01 02:32:56,hacker_news
Stereo Images of Giant Galaxies,6,3,https://www.bbc.com/future/article/20251121-sir-brian-mays-stereo-vision-of-galaxies,2025-12-01 02:32:57,hacker_news
Search tool that only returns content created before ChatGPT's public release,130,44,https://tegabrain.com/Slop-Evader,2025-12-01 06:45:38,hacker_news
It’s been a very hard year,35,15,https://bell.bz/its-been-a-very-hard-year/,2025-12-01 06:45:38,hacker_news
Google Antigravity just deleted the contents of whole drive,42,33,https://old.reddit.com/r/google_antigravity/comments/1p82or6/google_antigravity_just_deleted_the_contents_of/,2025-12-01 06:45:39,hacker_news
X210Ai is a new motherboard to upgrade ThinkPad X201/200,46,6,https://www.tpart.net/about-x210ai/,2025-12-01 06:45:39,hacker_news
SmartTube Compromised,13,0,https://www.aftvnews.com/smarttubes-official-apk-was-compromised-with-malware-what-you-should-do-if-you-use-it/,2025-12-01 06:45:39,hacker_news
Show HN: CurioQuest – A simple web trivia/fun facts game,3,0,https://curioquest.fun/,2025-12-01 06:45:40,hacker_news
"NVMe driver for Windows 2000, targeting both x86 and Alpha AXP platforms",32,0,https://github.com/techomancer/nvme2k,2025-12-01 06:45:40,hacker_news
Replacing My Window Manager with Google Chrome,26,8,https://foxmoss.com/blog/dote/,2025-12-01 06:45:40,hacker_news
How to run phones while being struck by suicide drones,77,18,https://nasa.cx/hn/posts/how-to-run-hundreds-of-phones-while-being-struck-by-suicide-drones/,2025-12-01 06:45:41,hacker_news
Is America's jobs market nearing a cliff?,138,244,https://www.economist.com/finance-and-economics/2025/11/30/is-americas-jobs-market-nearing-a-cliff,2025-12-01 06:45:41,hacker_news
Ly – A lightweight TUI (ncurses-like) display manager for Linux and BSD,23,0,https://codeberg.org/fairyglade/ly,2025-12-01 06:45:41,hacker_news
AI just proved Erdos Problem #124,152,43,https://www.erdosproblems.com/forum/thread/124#post-1892,2025-12-01 06:45:41,hacker_news
Seeing a Molecule's Quantum Shadow,13,1,https://physics.aps.org/articles/v18/s149,2025-12-01 06:45:41,hacker_news
Self-hosting a Matrix server for 5 years,65,18,https://yaky.dev/2025-11-30-self-hosting-matrix/,2025-12-01 13:00:52,hacker_news
Detection of triboelectric discharges during dust events on Mars,63,37,https://gizmodo.com/weve-detected-lightning-on-mars-for-the-first-time-2000691996,2025-12-01 13:00:52,hacker_news
Trifold is a tool to quickly and cheaply host static websites using a CDN,41,6,https://www.jpt.sh/projects/trifold/,2025-12-01 13:00:52,hacker_news
DeepSeekMath-V2: Towards Self-Verifiable Mathematical Reasoning,165,53,https://huggingface.co/deepseek-ai/DeepSeek-Math-V2,2025-12-01 13:00:52,hacker_news
"1GB Raspberry Pi 5, and memory-driven price rises",50,20,https://www.raspberrypi.com/news/1gb-raspberry-pi-5-now-available-at-45-and-memory-driven-price-rises/,2025-12-01 13:00:53,hacker_news
Whole-body Learning in Creating Mathematical/Architectural Structures [pdf],11,0,https://archive.bridgesmathart.org/2017/bridges2017-523.pdf,2025-12-01 13:00:53,hacker_news
N-Body Simulator – Interactive 3 Body Problem and Gravitational Physics,64,10,"https://trisolarchaos.com/?pr=lagrange&n=3&s=5.0&so=0.01&im=verlet&dt=5.00e-4&rt=1.0e-6&at=1.0e-8&bs=0.50&sf=0&sv=0&cm=free&kt=1&st=1&ag=0&tl=1500&cp=0.0000,0.0000,10.0000&ct=0.0000,0.0000,0.0000",2025-12-01 13:00:53,hacker_news
Games using anti-cheats and their compatibility with GNU/Linux or Wine/Proton,78,68,https://areweanticheatyet.com/,2025-12-01 13:00:53,hacker_news
Cuddle Fish – A Soft Floating Robot for Safe Physical Interaction,7,1,https://kaikunze.de/post/2025-11.18-cuddle-fish/,2025-12-01 13:00:54,hacker_news
Engineers repurpose a mosquito proboscis to create a 3D printing nozzle,60,26,https://techxplore.com/news/2025-11-repurpose-mosquito-proboscis-3d-nozzle.html,2025-12-01 13:00:54,hacker_news
Accenture dubs 800k staff 'reinventors' amid shift to AI,23,10,https://www.theguardian.com/business/2025/dec/01/accenture-rebrands-staff-reinventors-ai-artificial-intelligence,2025-12-01 13:00:54,hacker_news
High-income job losses are cooling housing demand,47,17,https://jbrec.com/insights/job-growth-housing-demand-metro-analysis-2026/,2025-12-01 18:45:44,hacker_news
Ask HN: Who is hiring? (December 2025),113,138,https://news.ycombinator.com/item?id=46108941,2025-12-01 18:45:44,hacker_news
DeepSeek-v3.2: Pushing the frontier of open large language models [pdf],49,16,https://huggingface.co/deepseek-ai/DeepSeek-V3.2/resolve/main/assets/paper.pdf,2025-12-01 18:45:44,hacker_news
India orders smartphone makers to preload state-owned cyber safety app,51,13,https://www.reuters.com/sustainability/boards-policy-regulation/india-orders-mobile-phones-preloaded-with-government-app-ensure-cyber-safety-2025-12-01/,2025-12-01 18:45:44,hacker_news
"Why xor eax, eax?",347,134,https://xania.org/202512/01-xor-eax-eax,2025-12-01 18:45:44,hacker_news
Response to Ruby Is Not a Serious Programming Language,19,7,https://robbyonrails.com/articles/2025/12/01/why-so-serious/,2025-12-01 18:45:44,hacker_news
Cartographers Have Been Hiding Covert Illustrations Inside of Switzerland's Maps,167,38,https://eyeondesign.aiga.org/for-decades-cartographers-have-been-hiding-covert-illustrations-inside-of-switzerlands-official-maps/,2025-12-01 18:45:44,hacker_news
Isn't WSL2 just a VM?,68,32,https://ssg.dev/isnt-wsl2-just-a-vm/,2025-12-01 18:45:44,hacker_news
Better Auth (YC X25) Is Hiring,1,0,https://www.ycombinator.com/companies/better-auth/jobs/eKk5nLt-developer-relation-engineer,2025-12-01 18:45:44,hacker_news
Ask HN: Who wants to be hired? (December 2025),32,78,https://news.ycombinator.com/item?id=46108940,2025-12-01 18:45:44,hacker_news
ImAnim: Modern animation capabilities to ImGui applications,41,9,https://github.com/soufianekhiat/ImAnim,2025-12-01 18:45:44,hacker_news
Google unkills JPEG XL?,140,122,https://tonisagrista.com/blog/2025/google-unkills-jpegxl/,2025-12-01 18:45:44,hacker_news
A vector graphics workstation from the 70s,85,15,https://justanotherelectronicsblog.com/?p=1429,2025-12-01 18:45:45,hacker_news
Historic Engineering Wonders: Photos That Reveal How They Pulled It Off,82,14,https://rarehistoricalphotos.com/engineering-methods-from-the-past/,2025-12-01 18:45:45,hacker_news
"Runway rolls out new AI video model that beats Google, OpenAI in key benchmark",7,3,https://www.cnbc.com/2025/12/01/runway-gen-4-5-video-model-google-open-ai.html,2025-12-01 18:45:45,hacker_news
I made a quieter air purifier,80,42,https://chillphysicsenjoyer.substack.com/p/i-made-a-quieter-air-purifier,2025-12-01 18:45:45,hacker_news
WordPress plugin quirk resulted in UK Gov OBR Budget leak [pdf],92,87,https://obr.uk/docs/dlm_uploads/01122025-Investigation-into-November-2025-EFO-publication-error.pdf,2025-12-01 18:45:45,hacker_news
Spleen Monospaced Bitmap Fonts,11,3,https://github.com/fcambus/spleen,2025-12-01 18:45:45,hacker_news
The Penicillin Myth,88,47,https://www.asimov.press/p/penicillin-myth,2025-12-01 18:45:45,hacker_news
Anthropic: AI agents find $4.6M in blockchain smart contract exploits,58,41,https://red.anthropic.com/2025/smart-contracts/,2025-12-02 02:08:37,hacker_news
Last Week on My Mac: Losing confidence,223,84,https://eclecticlight.co/2025/11/30/last-week-on-my-mac-losing-confidence/,2025-12-02 02:08:37,hacker_news
Arcee Trinity Mini: US-Trained Moe Model,17,4,https://www.arcee.ai/blog/the-trinity-manifesto?src=hn,2025-12-02 02:08:37,hacker_news
Ghostty compiled to WASM with xterm.js API compatibility,238,77,https://github.com/coder/ghostty-web,2025-12-02 02:08:37,hacker_news
Apple AI chief John Giannandrea is retiring in spring 2026,181,207,https://www.macrumors.com/2025/12/01/apple-ai-chief-retiring-after-siri-failure/,2025-12-02 02:08:38,hacker_news
Cartographers have been hiding illustrations inside Switzerland’s maps (2020),248,50,https://eyeondesign.aiga.org/for-decades-cartographers-have-been-hiding-covert-illustrations-inside-of-switzerlands-official-maps/,2025-12-02 02:08:38,hacker_news
"Around The World, Part 27: Planting trees",6,0,https://frozenfractal.com/blog/2025/11/28/around-the-world-27-planting-trees/,2025-12-02 02:08:38,hacker_news
Instagram chief orders staff back to the office five days a week in 2026,125,136,https://www.businessinsider.com/instagram-chief-adam-mosseri-announces-five-day-office-return-2025-12,2025-12-02 02:08:38,hacker_news
"Google, Nvidia, and OpenAI",102,100,https://stratechery.com/2025/google-nvidia-and-openai/,2025-12-02 02:08:38,hacker_news
"Codex, Opus, Gemini try to build Counter Strike",83,20,https://www.instantdb.com/essays/agents_building_counterstrike,2025-12-02 02:08:38,hacker_news
Myths of Fleming's Penicillin Discovery,6,1,https://press.asimov.com/articles/penicillin-myth,2025-12-02 02:08:38,hacker_news
Durin is a library for reading and writing the Dwarf debugging format,49,13,https://github.com/tmcgilchrist/durin,2025-12-02 02:08:39,hacker_news
10 years of writing a blog nobody reads,112,56,https://flowtwo.io/post/on-10-years-of-writing-a-blog-nobody-reads,2025-12-02 02:08:39,hacker_news
US air travelers without REAL IDs will be charged a $45 fee,33,37,https://apnews.com/article/real-id-fee-airport-security-travel-tsa-fe8c7ed55cf3dacafa10d50cc2112eb7,2025-12-02 02:08:39,hacker_news
Mozilla's latest quagmire,85,64,https://rubenerd.com/mozillas-latest-quagmire/,2025-12-02 02:08:39,hacker_news
John Giannandrea to Retire from Apple,28,8,https://www.apple.com/newsroom/2025/12/john-giannandrea-to-retire-from-apple/,2025-12-02 02:08:39,hacker_news
Amazon faces FAA probe after delivery drone snaps internet cable in Texas,130,101,https://www.cnbc.com/2025/11/25/amazon-faa-probe-delivery-drone-incident-texas.html,2025-12-02 02:08:39,hacker_news
What will enter the public domain in 2026?,144,33,https://publicdomainreview.org/features/entering-the-public-domain/2026/,2025-12-02 06:43:00,hacker_news
Beej's Guide to Learning Computer Science,134,22,https://beej.us/guide/bglcs/html/split/,2025-12-02 06:43:00,hacker_news
Tom Stoppard has died,54,6,https://www.bbc.com/news/articles/c74xe49q7vlo,2025-12-02 06:43:00,hacker_news
Reverse math shows why hard problems are hard,55,6,https://www.quantamagazine.org/reverse-mathematics-illuminates-why-hard-problems-are-hard-20251201/,2025-12-02 06:43:00,hacker_news
Decreasing Certificate Lifetimes to 45 Days,39,3,https://letsencrypt.org/2025/12/02/from-90-to-45.html,2025-12-02 06:43:00,hacker_news
Beej's Guide to C Programming,6,3,https://beej.us/guide/bgc/,2025-12-02 06:43:00,hacker_news
Frequently Asked Unicycling Questions,11,3,https://vale.rocks/posts/unicycle-faq,2025-12-02 06:43:01,hacker_news
Notes on Bhutan,11,0,https://apropos.substack.com/p/notes-on-bhutan,2025-12-02 06:43:01,hacker_news
Tested: 1981 Datsun 280ZX Turbo (1981),35,44,https://www.caranddriver.com/reviews/a69529696/1981-datsun-280-zx-turbo-archive-test/,2025-12-02 06:43:01,hacker_news
AI agents find $4.6M in blockchain smart contract exploits,154,80,https://red.anthropic.com/2025/smart-contracts/,2025-12-02 06:43:01,hacker_news
A Bus Ride and the (At Least) 3x UX FAILs,4,0,https://bsdly.blogspot.com/2025/11/a-bus-ride-and-at-least-3x-ux-fails.html,2025-12-02 06:43:01,hacker_news
John Giannandrea to retire from Apple,75,289,https://www.apple.com/newsroom/2025/12/john-giannandrea-to-retire-from-apple/,2025-12-02 06:43:01,hacker_news
Dark Corners of Unicode (2015),9,1,https://eev.ee/blog/2015/09/12/dark-corners-of-unicode/,2025-12-02 06:43:01,hacker_news
Addressing the adding situation,73,6,https://xania.org/202512/02-adding-integers,2025-12-02 13:00:34,hacker_news
Advent of Compiler Optimisations 2025,120,6,https://xania.org/202511/advent-of-compiler-optimisation,2025-12-02 13:00:34,hacker_news
Apple Releases Open Weights Video Model,225,55,https://starflow-v.github.io,2025-12-02 13:00:34,hacker_news
Comparing AWS Lambda ARM64 vs. x86_64 Performance Across Runtimes in Late 2025,45,9,https://chrisebert.net/comparing-aws-lambda-arm64-vs-x86_64-performance-across-multiple-runtimes-in-late-2025/,2025-12-02 13:00:34,hacker_news
YouTube increases FreeBASIC performance (2019),49,6,https://freebasic.net/forum/viewtopic.php?t=27927,2025-12-02 13:00:35,hacker_news
Rootless Pings in Rust,80,44,https://bou.ke/blog/rust-ping/,2025-12-02 13:00:35,hacker_news
Beej's Guide to Learning Computer Science,190,62,https://beej.us/guide/bglcs/,2025-12-02 13:00:35,hacker_news
How Brian Eno Created Ambient 1: Music for Airports (2019),71,39,https://reverbmachine.com/blog/deconstructing-brian-eno-music-for-airports/,2025-12-02 13:00:35,hacker_news
Why Replicate is joining Cloudflare,55,39,https://blog.cloudflare.com/why-replicate-joining-cloudflare/,2025-12-02 13:00:35,hacker_news
Wacky Fun Physics Ideas,14,1,https://scottlocklin.wordpress.com/2025/11/22/wacky-fun-physics-ideas/,2025-12-02 13:00:35,hacker_news
Man unexpectedly cured of HIV after stem cell transplant,47,4,https://www.newscientist.com/article/2506595-man-unexpectedly-cured-of-hiv-after-stem-cell-transplant/,2025-12-02 13:00:35,hacker_news
URL in C (2011),49,16,https://susam.net/url-in-c.html,2025-12-02 13:00:35,hacker_news
"After Windows Update, Password icon invisible, click where it used to be",103,71,https://support.microsoft.com/en-us/topic/august-29-2025-kb5064081-os-build-26100-5074-preview-3f9eb9e1-72ca-4b42-af97-39aace788d93,2025-12-02 13:00:35,hacker_news
An LED panel that shows the aviation around you,5,1,https://github.com/AxisNimble/TheFlightWall_OSS,2025-12-02 13:00:36,hacker_news
Invisible details of interaction design (2023),28,3,https://rauno.me/craft/interaction-design,2025-12-02 13:00:36,hacker_news
Bun is joining Anthropic,260,99,https://bun.com/blog/bun-joins-anthropic,2025-12-02 18:43:58,hacker_news
100000 TPS over a billion rows: the unreasonable effectiveness of SQLite,60,5,https://andersmurphy.com/2025/12/02/100000-tps-over-a-billion-rows-the-unreasonable-effectiveness-of-sqlite.html,2025-12-02 18:43:58,hacker_news
The Junior Hiring Crisis,36,15,https://people-work.io/blog/junior-hiring-crisis/,2025-12-02 18:43:58,hacker_news
I Designed and Printed a Custom Nose Guard to Help My Dog with DLE,164,19,https://snoutcover.com/billie-story,2025-12-02 18:43:58,hacker_news
Learning Music with Strudel,253,62,https://terryds.notion.site/Learning-Music-with-Strudel-2ac98431b24180deb890cc7de667ea92,2025-12-02 18:43:58,hacker_news
Mistral 3 family of models released,444,143,https://mistral.ai/news/mistral-3,2025-12-02 18:43:58,hacker_news
Nixtml: Static website and blog generator written in Nix,66,17,https://github.com/arnarg/nixtml,2025-12-02 18:43:58,hacker_news
Poka Labs (YC S24) Is Hiring a Founding Engineer,1,0,https://www.ycombinator.com/companies/poka-labs/jobs/RCQgmqB-founding-engineer,2025-12-02 18:43:58,hacker_news
YesNotice,87,40,https://infinitedigits.co/docs/software/yesnotice/,2025-12-02 18:43:59,hacker_news
4.3M Browsers Infected: Inside ShadyPanda's 7-Year Malware Campaign,31,4,https://www.koi.ai/blog/4-million-browsers-infected-inside-shadypanda-7-year-malware-campaign,2025-12-02 18:43:59,hacker_news
Python Data Science Handbook,136,28,https://jakevdp.github.io/PythonDataScienceHandbook/,2025-12-02 18:43:59,hacker_news
IBM CEO says there is 'no way' spending on AI data centers will pay off,31,10,https://www.businessinsider.com/ibm-ceo-big-tech-ai-capex-data-center-spending-2025-12,2025-12-02 18:43:59,hacker_news
"Show HN: Marmot – Single-binary data catalog (no Kafka, no Elasticsearch)",68,12,https://github.com/marmotdata/marmot,2025-12-02 18:43:59,hacker_news
Lowtype: Elegant Types in Ruby,28,7,https://codeberg.org/Iow/type,2025-12-02 18:43:59,hacker_news
A series of vignettes from my childhood and early career,112,76,https://www.jasonscheirer.com/weblog/vignettes/,2025-12-02 18:43:59,hacker_news
School Cell Phone Bans and Student Achievement (NBER Digest),4,1,https://www.nber.org/digest/202512/school-cell-phone-bans-and-student-achievement,2025-12-02 18:44:00,hacker_news
Anthropic Acquires Bun,26,10,https://www.anthropic.com/news/anthropic-acquires-bun-as-claude-code-reaches-usd1b-milestone,2025-12-02 18:44:00,hacker_news
Lazier Binary Decision Diagrams for set-theoretic types,38,5,https://elixir-lang.org/blog/2025/12/02/lazier-bdds-for-set-theoretic-types/,2025-12-02 18:44:00,hacker_news
Apple to beat Samsung in smartphone shipments for first time in 14 years,31,29,https://sherwood.news/tech/apple-to-beat-samsung-in-smartphone-shipments-for-first-time-in-14-years/,2025-12-02 18:44:00,hacker_news
Anthropic acquires Bun,1408,690,https://bun.com/blog/bun-joins-anthropic,2025-12-03 02:08:29,hacker_news
Paged Out,222,29,https://pagedout.institute,2025-12-03 02:08:29,hacker_news
I designed and printed a custom nose guard to help my dog with DLE,403,54,https://snoutcover.com/billie-story,2025-12-03 02:08:29,hacker_news
OpenAI declares 'code red' as Google catches up in AI race,444,528,https://www.theverge.com/news/836212/openai-code-red-chatgpt,2025-12-03 02:08:29,hacker_news
Amazon launches Trainium3,127,52,https://techcrunch.com/2025/12/02/amazon-releases-an-impressive-new-ai-chip-and-teases-a-nvidia-friendly-roadmap/,2025-12-03 02:08:29,hacker_news
DOOM could have had PC Speaker Music,25,21,https://lenowo.org/viewtopic.php?t=45,2025-12-03 02:08:29,hacker_news
Free static site generator for small restaurants and cafes,83,54,https://lite.localcafe.org/,2025-12-03 02:08:29,hacker_news
Learning music with Strudel,386,96,https://terryds.notion.site/Learning-Music-with-Strudel-2ac98431b24180deb890cc7de667ea92,2025-12-03 02:08:30,hacker_news
Qwen3-VL can scan two-hour videos and pinpoint nearly every detail,100,28,https://the-decoder.com/qwen3-vl-can-scan-two-hour-videos-and-pinpoint-nearly-every-detail/,2025-12-03 02:08:30,hacker_news
Ecosia: The greenest AI is here,60,34,https://blog.ecosia.org/ecosia-ai/,2025-12-03 02:08:30,hacker_news
All about automotive lidar,95,48,https://mainstreetautonomy.com/blog/2025-08-29-all-about-automotive-lidar/,2025-12-03 02:08:30,hacker_news
Zig's new plan for asynchronous programs,219,170,https://lwn.net/SubscriberLink/1046084/4c048ee008e1c70e/,2025-12-03 02:08:30,hacker_news
100k TPS over a billion rows: the unreasonable effectiveness of SQLite,283,103,https://andersmurphy.com/2025/12/02/100000-tps-over-a-billion-rows-the-unreasonable-effectiveness-of-sqlite.html,2025-12-03 02:08:30,hacker_news
