title,upvotes,comments,link,post_time,platform
The Weird Way the 404 Media Zine Was Built,9,0,https://tedium.co/2025/12/10/404-media-zine-linux-affinity/?,2025-12-12 02:13:42,hacker_news
Pdsink: USB Power Delivery Sink library for embedded devices,12,3,https://github.com/pdsink/pdsink,2025-12-12 02:13:43,hacker_news
UK House of Lords attempting to ban use of VPNs by anyone under 16,288,272,https://alecmuffett.com/article/134925,2025-12-12 02:13:43,hacker_news
Almond (YC X25) Is Hiring SWEs and MechEs,1,0,https://www.ycombinator.com/companies/almond-2/jobs,2025-12-12 02:13:43,hacker_news
The Walt Disney Company and OpenAI Partner on Sora,159,417,https://openai.com/index/disney-sora-agreement/,2025-12-12 02:13:43,hacker_news
Notes on Gamma,3,0,https://poniesandlight.co.uk/reflect/gamma/,2025-12-12 02:13:43,hacker_news
"Powder and stone, or, why medieval rulers loved castles",31,4,https://1517.substack.com/p/powder-and-stone-or-why-medieval,2025-12-12 02:13:43,hacker_news
My productivity app is a never-ending .txt file (2020),165,117,https://jeffhuang.com/productivity_text_file/,2025-12-12 02:13:43,hacker_news
EFF launches Age Verification Hub,244,214,https://www.eff.org/press/releases/eff-launches-age-verification-hub-resource-against-misguided-laws,2025-12-12 02:13:44,hacker_news
French supermarket's Christmas advert is worldwide hit (without AI) [video],224,128,https://www.youtube.com/watch?v=Na9VmMNJvsA,2025-12-12 02:13:44,hacker_news
Stoolap: High-performance embedded SQL database in pure Rust,3,0,https://github.com/stoolap/stoolap,2025-12-12 02:13:44,hacker_news
"Going Through Snowden Documents, Part 1",194,122,https://libroot.org/posts/going-through-snowden-documents-part-1/,2025-12-12 02:13:44,hacker_news
"He set out to walk around the world. After 27 years, his quest is nearly over",26,4,https://www.washingtonpost.com/lifestyle/2025/12/05/karl-bushby-walk-around-world/,2025-12-12 06:44:53,hacker_news
"CRISPR fungus: Protein-packed, sustainable, and tastes like meat",60,23,https://www.isaaa.org/kc/cropbiotechupdate/article/default.asp?ID=21607,2025-12-12 06:44:53,hacker_news
Google De-Indexed My Bear Blog and I Don't Know Why,37,10,https://journal.james-zhan.com/google-de-indexed-my-entire-bear-blog-and-i-dont-know-why/,2025-12-12 06:44:53,hacker_news
Laying out the 404 Media zine,47,5,https://tedium.co/2025/12/10/404-media-zine-linux-affinity/?,2025-12-12 06:44:54,hacker_news
Cadmium Zinc Telluride: The wonder material powering a medical 'revolution',31,6,https://www.bbc.com/news/articles/c24l223d9n7o,2025-12-12 06:44:54,hacker_news
Dependent Names with a Little Encouragement,3,0,https://consteval.ca/2025/09/27/dependent-names/,2025-12-12 06:44:54,hacker_news
The HTML-First Approach: Why Htmx and Lightweight Frameworks Are Revolutionizin,22,5,https://www.danieleteti.it/post/html-first-frameworks-htmx-revolution-en/#building-with-html-instead-of-fighting-with-javascript-layers-,2025-12-12 06:44:54,hacker_news
After 27 years within budget Austria open 6thlongest railway tunnel in the world,117,34,https://infrastruktur.oebb.at/en/projects-for-austria/railway-lines/southern-line-vienna-villach/koralm-railway,2025-12-12 12:59:44,hacker_news
4 billion if statements (2023),117,47,https://andreasjhkarlsson.github.io//jekyll/update/2023/12/27/4-billion-if-statements.html,2025-12-12 12:59:44,hacker_news
The tiniest yet real telescope I've built,144,30,https://lucassifoni.info/blog/miniscope-tiny-telescope/,2025-12-12 12:59:45,hacker_news
From text to token: How tokenization pipelines work,13,1,https://www.paradedb.com/blog/when-tokenization-becomes-token,2025-12-12 12:59:45,hacker_news
"The Tor Project Is Making a Switch to Rust, Ditches C",27,1,https://itsfoss.com/news/tor-rust-rewrite-progress/,2025-12-12 12:59:45,hacker_news
Show HN: Tripwire: A new anti evil maid defense,5,0,https://github.com/fr33-sh/Tripwire,2025-12-12 12:59:45,hacker_news
Google de-indexed Bear Blog and I don't know why,218,89,https://journal.james-zhan.com/google-de-indexed-my-entire-bear-blog-and-i-dont-know-why/,2025-12-12 12:59:45,hacker_news
Octo: A Chip8 IDE,17,1,https://github.com/JohnEarnest/Octo,2025-12-12 12:59:45,hacker_news
What folk can do,8,3,https://folk.computer/guides/what-folk-can-do,2025-12-12 12:59:46,hacker_news
Spirograph style Lego drawing machine,24,3,https://jkbrickworks.com/simple-drawing-machine/,2025-12-12 12:59:46,hacker_news
Guarding My Git Forge Against AI Scrapers,56,41,https://vulpinecitrus.info/blog/guarding-git-forge-ai-scrapers/,2025-12-12 12:59:46,hacker_news
Smartphone without a battery (2022),43,9,https://yaky.dev/2022-09-06-smartphone-without-battery/,2025-12-12 12:59:46,hacker_news
Training LLMs for Honesty via Confessions,4,1,https://arxiv.org/abs/2512.08093,2025-12-12 12:59:47,hacker_news
SQLite JSON at Full Index Speed Using Generated Columns,203,73,https://www.dbpro.app/blog/sqlite-json-virtual-columns-indexing,2025-12-12 18:42:10,hacker_news
Async DNS,31,5,https://flak.tedunangst.com/post/async-dns,2025-12-12 18:42:11,hacker_news
"String Theory Inspires a Brilliant, Baffling New Math Proof",21,1,https://www.quantamagazine.org/string-theory-inspires-a-brilliant-baffling-new-math-proof-20251212/,2025-12-12 18:42:11,hacker_news
Show HN: tomcp.org – Turn any URL into an MCP server,16,6,https://github.com/Ami3466/tomcp,2025-12-12 18:42:11,hacker_news
Epic celebrates the end of the Apple Tax after court win in iOS payments case,138,86,https://arstechnica.com/tech-policy/2025/12/epic-celebrates-the-end-of-the-apple-tax-after-appeals-court-win-in-ios-payments-case/,2025-12-12 18:42:11,hacker_news
CM0 – a new Raspberry Pi you can't buy,51,3,https://www.jeffgeerling.com/blog/2025/cm0-new-raspberry-pi-you-cant-buy,2025-12-12 18:42:11,hacker_news
Id Software devs form wall-to-wall union,30,3,https://www.rockpapershotgun.com/id-software-devs-form-wall-to-wall-union-with-165-workers-at-doom-studio-the-latest-to-vote-in-favour,2025-12-12 18:42:11,hacker_news
Fedora: Open-source repository for long-term digital preservation,68,36,https://fedorarepository.org/,2025-12-12 18:42:11,hacker_news
Oracle made a $300B bet on OpenAI. It's paying the price,70,44,https://finance.yahoo.com/news/oracle-made-a-300-billion-bet-on-openai-its-paying-the-price-205441863.html,2025-12-12 18:42:11,hacker_news
Google Releases Its New Google Sans Flex Font as Open Source,24,0,https://www.omgubuntu.co.uk/2025/11/google-sans-flex-font-ubuntu,2025-12-12 18:42:12,hacker_news
Framework Raises DDR5 Memory Prices by 50% for DIY Laptops,94,67,https://www.phoronix.com/news/Framework-50p-DDR5-Memory,2025-12-12 18:42:12,hacker_news
Bit flips: How cosmic rays grounded a fleet of aircraft,4,0,https://www.bbc.com/future/article/20251201-how-cosmic-rays-grounded-thousands-of-aircraft,2025-12-12 18:42:12,hacker_news
BpfJailer: eBPF Mandatory Access Control [pdf],37,4,https://lpc.events/event/19/contributions/2159/attachments/1833/3929/BpfJailer%20LPC%202025.pdf,2025-12-12 18:42:12,hacker_news
Microservices Should Form a Polytree,54,50,https://bytesauna.com/post/microservices,2025-12-12 18:42:12,hacker_news
Berlin Approves New Expansion of Police Surveillance Powers,96,56,https://reclaimthenet.org/berlin-approves-new-expansion-of-police-surveillance-powers,2025-12-12 18:42:13,hacker_news
Koralm Railway,276,157,https://infrastruktur.oebb.at/en/projects-for-austria/railway-lines/southern-line-vienna-villach/koralm-railway,2025-12-12 18:42:13,hacker_news
Japan law opening phone app stores to go into effect dec.18th,30,8,https://www3.nhk.or.jp/nhkworld/en/news/20251210_B1/,2025-12-12 18:42:13,hacker_news
"OpenAI are quietly adopting skills, now available in ChatGPT and Codex CLI",107,61,https://simonwillison.net/2025/Dec/12/openai-skills/,2025-12-13 02:05:41,hacker_news
macOS 26.2 enables fast AI clusters with RDMA over Thunderbolt,275,144,https://developer.apple.com/documentation/macos-release-notes/macos-26_2-release-notes#RDMA-over-Thunderbolt,2025-12-13 02:05:41,hacker_news
GNU Unifont,152,45,https://unifoundry.com/unifont/index.html,2025-12-13 02:05:41,hacker_news
"Show HN: Tiny VM sandbox in C with apps in Rust, C and Zig",67,4,https://github.com/ringtailsoftware/uvm32,2025-12-13 02:05:41,hacker_news
Show HN: I made a spreadsheet where formulas also update backwards,59,18,https://victorpoughon.github.io/bidicalc/,2025-12-13 02:05:41,hacker_news
Rats Play DOOM,179,78,https://ratsplaydoom.com/,2025-12-13 02:05:41,hacker_news
Capsudo: Rethinking Sudo with Object Capabilities,36,11,https://ariadne.space/2025/12/12/rethinking-sudo-with-object-capabilities.html,2025-12-13 02:05:42,hacker_news
Ensuring a National Policy Framework for Artificial Intelligence,64,92,https://www.whitehouse.gov/presidential-actions/2025/12/eliminating-state-law-obstruction-of-national-artificial-intelligence-policy/,2025-12-13 02:05:42,hacker_news
"Go is portable, until it isn't",24,21,https://simpleobservability.com/blog/go-portable-until-isnt,2025-12-13 02:05:42,hacker_news
Freeing a Xiaomi humidifier from the cloud,28,16,https://0l.de/blog/2025/11/xiaomi-humidifier/,2025-12-13 02:05:42,hacker_news
SQLite JSON at full index speed using generated columns,314,97,https://www.dbpro.app/blog/sqlite-json-virtual-columns-indexing,2025-12-13 02:05:42,hacker_news
50 years of proof assistants,30,2,https://lawrencecpaulson.github.io//2025/12/05/History_of_Proof_Assistants.html,2025-12-13 02:05:42,hacker_news
Security issues with electronic invoices,74,42,https://invoice.secvuln.info/,2025-12-13 02:05:42,hacker_news
Sick of smart TVs? Here are your best options,109,133,https://arstechnica.com/gadgets/2025/12/the-ars-technica-guide-to-dumb-tvs/,2025-12-13 02:05:42,hacker_news
Building small Docker images faster,26,6,https://sgt.hootr.club/blog/docker-protips/,2025-12-13 02:05:42,hacker_news
Motion (YC W20) Is Hiring Senior Staff Front End Engineers,1,0,https://jobs.ashbyhq.com/motion/715d9646-27d4-44f6-9229-61eb0380ae39,2025-12-13 02:05:42,hacker_news
Pg_ClickHouse: A Postgres extension for querying ClickHouse,70,28,https://clickhouse.com/blog/introducing-pg_clickhouse,2025-12-13 02:05:43,hacker_news
"Home Depot GitHub token exposed for a year, granted access to internal systems",191,115,https://techcrunch.com/2025/12/12/home-depot-exposed-access-to-internal-systems-for-a-year-says-researcher/,2025-12-13 02:05:43,hacker_news
"String theory inspires a brilliant, baffling new math proof",110,106,https://www.quantamagazine.org/string-theory-inspires-a-brilliant-baffling-new-math-proof-20251212/,2025-12-13 02:05:43,hacker_news
CM0 – A new Raspberry Pi you can't buy,165,40,https://www.jeffgeerling.com/blog/2025/cm0-new-raspberry-pi-you-cant-buy,2025-12-13 02:05:43,hacker_news
The Checkerboard,3,0,https://99percentinvisible.org/episode/650-the-checkerboard/,2025-12-13 02:05:43,hacker_news
C64 Maze Chomp.BAS,15,1,https://basic-code.bearblog.dev/c64-maze-chompbas/,2025-12-13 02:05:43,hacker_news
Microservices should form a polytree,107,100,https://bytesauna.com/post/microservices,2025-12-13 02:05:43,hacker_news
Fast Median Filter over arbitrary datatypes,22,1,https://martianlantern.github.io/2025/09/median-filter-over-arbitrary-datatypes/,2025-12-13 02:05:43,hacker_news
Poor Johnny still won't encrypt,25,31,https://bfswa.substack.com/p/poor-johnny-still-wont-encrypt,2025-12-13 06:40:38,hacker_news
"Apple has locked my Apple ID, and I have no recourse. A plea for help",164,56,https://hey.paris/posts/appleid/,2025-12-13 06:40:38,hacker_news
1300 Still Images from the Animated Films of Hayao Miyazaki's Studio Ghibli (2023),47,11,https://www.ghibli.jp/info/013772/,2025-12-13 06:40:38,hacker_news
Ferrari's Formula 1 Handovers: Handovers from Surgery to Intensive Care 2008;pdf,31,9,https://gwern.net/doc/technology/2008-sower.pdf,2025-12-13 06:40:39,hacker_news
Gild Just One Lily,7,0,https://www.smashingmagazine.com/2025/04/gild-just-one-lily/,2025-12-13 06:40:39,hacker_news
So What Should We Call This – A Grue Jay?,39,14,https://cns.utexas.edu/news/research/so-what-should-we-call-grue-jay,2025-12-13 06:40:40,hacker_news
Slax: Live Pocket Linux,14,1,https://www.slax.org/,2025-12-13 06:40:40,hacker_news
The Coming Need for Formal Specification,11,11,https://benjamincongdon.me/blog/2025/12/12/The-Coming-Need-for-Formal-Specification/,2025-12-13 06:40:40,hacker_news
Beautiful Abelian Sandpiles,3,0,https://eavan.blog/posts/beautiful-sandpiles.html,2025-12-13 06:40:41,hacker_news
Google Removes Sci-Hub Domains from U.S. Search Results Due to Dated Court Order,61,17,https://torrentfreak.com/google-removes-sci-hub-domains-from-u-s-search-results-due-to-dated-court-order/,2025-12-13 06:40:41,hacker_news
Doxers Posing as Cops Are Tricking Big Tech Firms into Sharing People's Data,26,7,https://www.wired.com/story/doxers-posing-as-cops-are-tricking-big-tech-firms-into-sharing-peoples-private-data/,2025-12-13 06:40:41,hacker_news
"Photographer built a medium-format rangefinder, and so can you",56,5,https://petapixel.com/2025/12/06/this-photographer-built-an-awesome-medium-format-rangefinder-and-so-can-you/,2025-12-13 12:54:11,hacker_news
A 'toaster with a lens': The story behind the first handheld digital camera,29,7,https://www.bbc.com/future/article/20251205-how-the-handheld-digital-camera-was-born,2025-12-13 12:54:11,hacker_news
Formula One Handovers and Handovers From Surgery to Intensive Care (2008) [pdf],67,24,https://gwern.net/doc/technology/2008-sower.pdf,2025-12-13 12:54:12,hacker_news
How Exchanges Turn Order Books into Distributed Logs,4,0,https://quant.engineering/exchange-order-book-distributed-logs.html,2025-12-13 12:54:12,hacker_news
Computer Animator and Amiga fanatic Dick Van Dyke turns 100,59,13,https://news.ycombinator.com/item?id=46252993,2025-12-13 12:54:12,hacker_news
Optical context compression is just (bad) autoencoding,8,0,https://arxiv.org/abs/2512.03643,2025-12-13 12:54:13,hacker_news
Capsudo: Rethinking sudo with object capabilities,71,38,https://ariadne.space/2025/12/12/rethinking-sudo-with-object-capabilities.html,2025-12-13 12:54:13,hacker_news
Google removes Sci-Hub domains from U.S. search results due to dated court order,161,28,https://torrentfreak.com/google-removes-sci-hub-domains-from-u-s-search-results-due-to-dated-court-order/,2025-12-13 12:54:13,hacker_news
Bookmark for CAD/2d/3D Useful links,20,4,https://github.com/yogananda-muthaiah/SAP-CPQ/tree/main/Integrations/CAD-2d-3d,2025-12-13 12:54:13,hacker_news
I tried Gleam for Advent of Code,72,26,https://blog.tymscar.com/posts/gleamaoc2025/,2025-12-13 18:36:16,hacker_news
"Fast, Memory-Efficient Hash Table in Java: Borrowing the Best Ideas",19,0,https://bluuewhale.github.io/posts/building-a-fast-and-memory-efficient-hash-table-in-java-by-borrowing-the-best-ideas/,2025-12-13 18:36:16,hacker_news
Analysis finds anytime electricity from solar available as battery costs plummet,32,17,https://pv-magazine-usa.com/2025/12/12/analysis-finds-anytime-electricity-from-solar-available-as-battery-costs-plummet/,2025-12-13 18:36:16,hacker_news
What is the nicest thing a stranger has ever done for you?,133,72,https://louplummer.lol/nice-stranger/,2025-12-13 18:36:16,hacker_news
Java FFM zero-copy transport using io_uring,71,25,https://www.mvp.express/,2025-12-13 18:36:16,hacker_news
Cryptids,38,4,https://wiki.bbchallenge.org/wiki/Cryptids,2025-12-13 18:36:17,hacker_news
Z8086: Rebuilding the 8086 from Original Microcode,13,4,https://nand2mario.github.io/posts/2025/z8086/,2025-12-13 18:36:17,hacker_news
How exchanges turn order books into distributed logs,92,49,https://quant.engineering/exchange-order-book-distributed-logs.html,2025-12-13 18:36:17,hacker_news
Useful patterns for building HTML tools,118,41,https://simonwillison.net/2025/Dec/10/html-tools/,2025-12-13 18:36:17,hacker_news
Researchers seeking better measures of cognitive fatigue,61,10,https://www.nature.com/articles/d41586-025-03974-w,2025-12-13 18:36:17,hacker_news
"Show HN: LinkedQL – Live Queries over Postgres, MySQL, MariaDB",15,6,https://github.com/linked-db/linked-ql,2025-12-13 18:36:17,hacker_news
Go Proposal: Secret Mode,71,18,https://antonz.org/accepted/runtime-secret/,2025-12-13 18:36:17,hacker_news
Indexing 100M vectors in 20 minutes on PostgreSQL with 12GB RAM,60,9,https://blog.vectorchord.ai/how-we-made-100m-vector-indexing-in-20-minutes-possible-on-postgresql,2025-12-13 18:36:17,hacker_news
A Lisp Interpreter Implemented in Conway's Game of Life (2021),59,2,https://woodrush.github.io/blog/posts/2022-01-12-lisp-in-life.html,2025-12-13 18:36:18,hacker_news
Dynamic Pong Wars,15,2,https://markodenic.tech/dynamic-pong-wars/,2025-12-13 18:36:18,hacker_news
Will West Coast Jazz Get Some Respect?,35,16,https://www.honest-broker.com/p/will-west-coast-jazz-finally-get,2025-12-13 18:36:18,hacker_news
Linux Sandboxes and Fil-C,106,23,https://fil-c.org/seccomp,2025-12-14 02:25:28,hacker_news
Closures as Win32 Window Procedures,39,3,https://nullprogram.com/blog/2025/12/12/,2025-12-14 02:25:28,hacker_news
Recovering Anthony Bourdain's (really) lost Li.st's,118,40,https://sandyuraz.com/blogs/bourdain/,2025-12-14 02:25:28,hacker_news
An Implementation of J,10,0,https://www.jsoftware.com/ioj/ioj.htm,2025-12-14 02:25:28,hacker_news
I fed 24 years of my blog posts to a Markov model,104,36,https://susam.net/fed-24-years-of-posts-to-markov-model.html,2025-12-14 02:25:28,hacker_news
VPN location claims don't match real traffic exits,256,146,https://ipinfo.io/blog/vpn-location-mismatch-report,2025-12-14 02:25:28,hacker_news
Cat Gap,42,5,https://en.wikipedia.org/wiki/Cat_gap,2025-12-14 02:25:28,hacker_news
Using E-Ink tablet as monitor for Linux,15,2,https://alavi.me/blog/e-ink-tablet-as-monitor-linux/,2025-12-14 02:25:29,hacker_news
"The Rise of Computer Games, Part I: Adventure",50,9,https://technicshistory.com/2025/12/13/the-rise-of-computer-games-part-i-adventure/,2025-12-14 02:25:29,hacker_news
Why Twilio Segment moved from microservices back to a monolith,172,133,https://www.twilio.com/en-us/blog/developers/best-practices/goodbye-microservices,2025-12-14 02:25:29,hacker_news
llamafile: Distribute and Run LLMs with a Single File,28,2,https://github.com/mozilla-ai/llamafile,2025-12-14 02:25:29,hacker_news
Ask HN: How can I get better at using AI for programming?,223,260,https://news.ycombinator.com/item?id=46255285,2025-12-14 02:25:29,hacker_news
"Free Software Awards Winners Announced: Andy Wingo, Alx Sa, Govdirectory",11,0,https://www.fsf.org/news/2024-free-software-awards-winners,2025-12-14 02:25:29,hacker_news
Awesome-Jj: Jujutsu Things,4,0,https://github.com/Necior/awesome-jj,2025-12-14 02:25:30,hacker_news
Some surprising things about DuckDuckGo,64,43,https://gabrielweinberg.com/p/some-surprising-things-about-duckduckgo,2025-12-14 02:25:30,hacker_news
A Giant Ball Will Help This Man Survive a Year on an Iceberg,43,34,https://www.outsideonline.com/outdoor-adventure/exploration-survival/how-giant-ball-will-help-man-survive-year-iceberg/,2025-12-14 02:25:30,hacker_news
From Azure Functions to FreeBSD,70,7,https://jmmv.dev/2025/12/from-azure-functions-to-freebsd.html,2025-12-14 02:25:30,hacker_news
EasyPost (YC S13) Is Hiring,1,0,https://www.easypost.com/careers,2025-12-14 02:25:30,hacker_news
Flat-pack washing machine spins a fairer future,57,26,https://www.positive.news/society/flat-pack-washing-machine-spins-a-fairer-future/,2025-12-14 02:25:30,hacker_news
Want to sway an election? Here’s how much fake online accounts cost,139,94,https://www.science.org/content/article/want-sway-election-here-s-how-much-fake-online-accounts-cost,2025-12-14 02:25:30,hacker_news
Are we stuck with the same Desktop UX forever? [video],120,125,https://www.youtube.com/watch?v=1fZTOjd_bOQ,2025-12-14 02:25:31,hacker_news
"If a Meta AI model can read a brain-wide signal, why wouldn't the brain?",43,17,https://1393.xyz/writing/if-a-meta-ai-model-can-read-a-brain-wide-signal-why-wouldnt-the-brain,2025-12-14 06:40:12,hacker_news
Lean Theorem Prover Mathlib,22,0,https://github.com/leanprover-community/mathlib4,2025-12-14 06:40:12,hacker_news
Therapeutic Use of Cannabis and Cannabinoids: A Review,29,11,https://jamanetwork.com/journals/jama/fullarticle/2842072?guestAccessKey=a368e622-e374-4a0c-8d3b-22a976500305,2025-12-14 06:40:13,hacker_news
Heavy metal is healing teens on the Blackfeet Nation,32,9,https://www.hcn.org/issues/57-11/heavy-metal-is-healing-teens-on-the-blackfeet-nation/,2025-12-14 06:40:13,hacker_news
No-Tifier (2017),5,0,https://subject.space/projects/no-tifier/,2025-12-14 06:40:13,hacker_news
Dhtml Lemmings (2004),18,8,https://www.elizium.nu/scripts/lemmings/index.php,2025-12-14 06:40:13,hacker_news
Mystery Science Theater 3000: The Definitive Oral History of a TV Masterpiece,31,4,https://www.wired.com/2014/04/mst3k-oral-history/,2025-12-14 06:40:13,hacker_news
Using Python for Scripting,114,85,https://hypirion.com/musings/use-python-for-scripting,2025-12-14 06:40:14,hacker_news
Using e-ink tablet as monitor for Linux,171,64,https://alavi.me/blog/e-ink-tablet-as-monitor-linux/,2025-12-14 12:53:50,hacker_news
Dagger: Define software delivery workflows and dev environments,15,4,https://dagger.io/,2025-12-14 12:53:50,hacker_news
Recovering Anthony Bourdain's Li.st's,227,95,https://sandyuraz.com/blogs/bourdain/,2025-12-14 12:53:50,hacker_news
Compiler Engineering in Practice,12,2,https://chisophugis.github.io/2025/12/08/compiler-engineering-in-practice-part-1-what-is-a-compiler.html,2025-12-14 12:53:50,hacker_news
Lean theorem prover mathlib,51,1,https://github.com/leanprover-community/mathlib4,2025-12-14 12:53:51,hacker_news
An Implementation of J (1992),66,25,https://www.jsoftware.com/ioj/ioj.htm,2025-12-14 12:53:51,hacker_news
Getting into Public Speaking,11,4,https://james.brooks.page/blog/getting-into-public-speaking,2025-12-14 12:53:51,hacker_news
Create a Markdown Editor in Ruby on Rails,21,1,https://blog.appsignal.com/2025/12/10/create-a-markdown-editor-in-ruby-on-rails.html,2025-12-14 12:53:51,hacker_news
“You should never build a CMS”,80,55,https://www.sanity.io/blog/you-should-never-build-a-cms,2025-12-14 12:53:51,hacker_news
"An off-grid, flat-packable washing machine",116,66,https://www.positive.news/society/flat-pack-washing-machine-spins-a-fairer-future/,2025-12-14 12:53:52,hacker_news
"Bye, Mom",70,16,https://aella.substack.com/p/bye-mom,2025-12-14 12:53:52,hacker_news
Hashcards: A Plain-Text Spaced Repetition System,54,9,https://borretti.me/article/hashcards-plain-text-spaced-repetition,2025-12-14 18:37:37,hacker_news
The Typeframe PX-88 Portable Computing System,18,2,https://www.typeframe.net/,2025-12-14 18:37:38,hacker_news
AI and the ironies of automation – Part 2,148,50,https://www.ufried.com/blog/ironies_of_ai_2/,2025-12-14 18:37:38,hacker_news
GraphQL: The Enterprise Honeymoon Is Over,15,9,https://johnjames.blog/posts/graphql-the-enterprise-honeymoon-is-over,2025-12-14 18:37:38,hacker_news
Sacrificing accessibility for not getting web scraped,15,11,https://tilschuenemann.de/projects/sacrificing-accessibility-for-not-getting-web-scraped,2025-12-14 18:37:38,hacker_news
Europeans' health data sold to US firm run by ex-Israeli spies,507,290,https://www.ftm.eu/articles/europe-health-data-us-firm-israel-spies,2025-12-14 18:37:38,hacker_news
Shai-Hulud compromised a dev machine and raided GitHub org access: a post-mortem,98,59,https://trigger.dev/blog/shai-hulud-postmortem,2025-12-14 18:37:38,hacker_news
Developing a food-safe finish for my wooden spoons,16,9,https://alinpanaitiu.com/blog/developing-hardwax-oil/,2025-12-14 18:37:38,hacker_news
Illuminating the processor core with LLVM-mca,35,2,https://abseil.io/fast/99,2025-12-14 18:37:38,hacker_news
Vacuum Is a Lie: About Your Indexes,44,24,https://boringsql.com/posts/vacuum-is-lie/,2025-12-14 18:37:38,hacker_news
Science Communications on YouTube,18,23,https://blogs.memphis.edu/awindsor/2025/02/25/science-communication-on-youtube/,2025-12-14 18:37:38,hacker_news
"Apple Maps claims it's 29,905 miles away",117,95,https://mathstodon.xyz/@dpiponi/115651419771418748,2025-12-14 18:37:38,hacker_news
Show HN: a Pager,6,4,https://www.udp7777.com/,2025-12-14 18:37:38,hacker_news
Kimi K2 1T model runs on 2 512GB M3 Ultras,130,61,https://twitter.com/awnihannun/status/1943723599971443134,2025-12-14 18:37:38,hacker_news
"Update Now: iOS 26.2 Fixes 20 Security Vulnerabilities, 2 Actively Exploited",59,44,https://www.macrumors.com/2025/12/12/ios-26-2-security-vulnerabilities/,2025-12-14 18:37:38,hacker_news
Efficient Basic Coding for the ZX Spectrum,27,6,https://blog.jafma.net/2020/02/24/efficient-basic-coding-for-the-zx-spectrum/,2025-12-14 18:37:38,hacker_news
Show HN: Cargo-rail: graph-aware monorepo tooling for Rust; 11 deps,35,3,https://github.com/loadingalias/cargo-rail,2025-12-14 18:37:39,hacker_news
Rust Coreutils 0.5.0 Release: 87.75% compatibility with GNU Coreutils,26,8,https://github.com/uutils/coreutils/releases/tag/0.5.0,2025-12-14 18:37:39,hacker_news
CapROS: The Capability-Based Reliable Operating System,22,4,https://www.capros.org/,2025-12-15 02:22:52,hacker_news
2002: Last.fm and Audioscrobbler Herald the Social Web,147,86,https://cybercultural.com/p/lastfm-audioscrobbler-2002/,2025-12-15 02:22:52,hacker_news
Elevated errors across many models,260,130,https://status.claude.com/incidents/9g6qpr72ttbr,2025-12-15 02:22:52,hacker_news
JSDoc is TypeScript,105,135,https://culi.bearblog.dev/jsdoc-is-typescript/,2025-12-15 02:22:52,hacker_news
Hashcards: A plain-text spaced repetition system,251,104,https://borretti.me/article/hashcards-plain-text-spaced-repetition,2025-12-15 02:22:52,hacker_news
Ask HN: What Are You Working On? (December 2025),145,511,https://news.ycombinator.com/item?id=46264491,2025-12-15 02:22:52,hacker_news
In the Beginning was the Command Line (1999),95,41,https://web.stanford.edu/class/cs81n/command.txt,2025-12-15 02:22:53,hacker_news
