title,upvotes,comments,link,post_time,platform
A terminal emulator that runs in your terminal. Powered by Turbo Vision,62,6,https://github.com/magiblot/tvterm,2025-12-20 12:53:44,hacker_news
Skills Officially Comes to Codex,56,18,https://developers.openai.com/codex/skills/,2025-12-20 12:53:44,hacker_news
"Raycaster (YC F24) Is Hiring a Research Engineer (NYC, In-Person)",1,0,https://news.ycombinator.com/item?id=46335552,2025-12-20 12:53:44,hacker_news
New Quantum Antenna Reveals a Hidden Terahertz World,35,1,https://www.sciencedaily.com/releases/2025/12/251213032617.htm,2025-12-20 12:53:44,hacker_news
Airbus to migrate critical apps to a sovereign Euro cloud,209,108,https://www.theregister.com/2025/12/19/airbus_sovereign_cloud/,2025-12-20 12:53:45,hacker_news
Contrails Map,52,18,https://map.contrails.org/,2025-12-20 12:53:45,hacker_news
A proof of concept of a semistable C++ vector container,5,0,https://github.com/joaquintides/semistable_vector,2025-12-20 12:53:45,hacker_news
Sharp: High performance Node.js image processing/optimization,21,1,https://github.com/lovell/sharp,2025-12-20 12:53:45,hacker_news
"Privacy doesn't mean anything anymore, anonymity does",127,91,https://servury.com/blog/privacy-is-marketing-anonymity-is-architecture/,2025-12-20 12:53:45,hacker_news
The Deviancy Signal: Having Nothing to Hide Is a Threat to Us All,69,41,https://thompson2026.com/blog/deviancy-signal/,2025-12-20 12:53:45,hacker_news
Hash tables in Go and advantage of self-hosted compilers,15,5,https://rushter.com/blog/go-and-hashmaps/,2025-12-20 12:53:46,hacker_news
"Pure Silicon Demo Coding: No CPU, No Memory, Just 4k Gates",101,4,https://www.a1k0n.net/2025/12/19/tiny-tapeout-demo.html,2025-12-20 18:35:49,hacker_news
Log level 'error' should mean that something needs to be fixed,148,77,https://utcc.utoronto.ca/~cks/space/blog/programming/ErrorsShouldRequireFixing,2025-12-20 18:35:49,hacker_news
"Go ahead, self-host Postgres",224,161,https://pierce.dev/notes/go-ahead-self-host-postgres#user-content-fn-1,2025-12-20 18:35:49,hacker_news
OpenSCAD Is Kinda Neat,20,9,https://nuxx.net/blog/2025/12/20/openscad-is-kinda-neat/,2025-12-20 18:35:49,hacker_news
Gemini 3 Pro vs. 2.5 Pro in Pokemon Crystal,173,48,https://blog.jcz.dev/gemini-3-pro-vs-25-pro-in-pokemon-crystal,2025-12-20 18:35:49,hacker_news
Immersa: Open-source Web-based 3D Presentation Tool,86,13,https://github.com/ertugrulcetin/immersa,2025-12-20 18:35:49,hacker_news
Depot (YC W23) Is Hiring an Enterprise Support Engineer (Remote/US),1,0,https://www.ycombinator.com/companies/depot/jobs/jhGxVjO-enterprise-support-engineer,2025-12-20 18:35:49,hacker_news
Maximizing Compression of Apple II Hi-Res Images,14,2,http://deater.net/weave/vmwprod/hgr_compress/,2025-12-20 18:35:50,hacker_news
Show HN: Claude Code Plugin to play music when waiting on user input,17,8,https://github.com/Sevii/agent-marketplace/blob/main/plugins/elevator-music/README.md,2025-12-20 18:35:50,hacker_news
Reflections on AI at the End of 2025,139,210,https://antirez.com/news/157,2025-12-20 18:35:50,hacker_news
A train-sized tunnel is now carrying electricity under South London,88,70,https://www.ianvisits.co.uk/articles/a-train-sized-tunnel-is-now-carrying-electricity-under-south-london-86221/,2025-12-20 18:35:51,hacker_news
Arduino UNO Q bridges high-performance computing with real-time control,37,20,https://www.arduino.cc/product-uno-q/,2025-12-20 18:35:51,hacker_news
"Extending ts-Wolfram: dropping OOP, kernel/userspace interop, better printing",4,1,https://www.spakhm.com/ts-wolfram-ext,2025-12-20 18:35:51,hacker_news
Over 40% of Deceased Drivers in Vehicle Crashes Test Positive for THC: Study,91,116,https://www.facs.org/media-center/press-releases/2025/over-40-of-deceased-drivers-in-motor-vehicle-crashes-test-positive-for-thc-study-shows/,2025-12-20 18:35:51,hacker_news
Show HN: Jmail – Google Suite for Epstein files,315,63,https://www.jmail.world,2025-12-21 02:25:18,hacker_news
Backing Up Spotify,845,296,https://annas-archive.li/blog/backing-up-spotify.html,2025-12-21 02:25:18,hacker_news
Flock and Cyble Inc. Weaponize Cybercrime Takedowns to Silence Critics,28,3,https://haveibeenflocked.com/news/cyble-downtime,2025-12-21 02:25:18,hacker_news
Ireland’s Diarmuid Early wins world Microsoft Excel title,182,63,https://www.bbc.com/news/articles/cj4qzgvxxgvo,2025-12-21 02:25:18,hacker_news
Claude in Chrome,99,45,https://claude.com/chrome,2025-12-21 02:25:19,hacker_news
Anatomy of US inequality,57,18,https://www.nber.org/papers/w34558,2025-12-21 02:25:19,hacker_news
Big GPUs don't need big PCs,143,50,https://www.jeffgeerling.com/blog/2025/big-gpus-dont-need-big-pcs,2025-12-21 02:25:19,hacker_news
Italian bears living near villages have evolved to be smaller and less agressive,56,21,https://phys.org/news/2025-12-italian-villages-evolved-smaller-aggressive.html,2025-12-21 02:25:19,hacker_news
I spent a week without IPv4 (2023),112,183,https://www.apalrd.net/posts/2023/network_ipv6/,2025-12-21 02:25:19,hacker_news
Show HN: HN Wrapped 2025 - an LLM reviews your year on HN,124,68,https://hn-wrapped.kadoa.com?year=2025,2025-12-21 02:25:19,hacker_news
OpenSCAD is kinda neat,204,148,https://nuxx.net/blog/2025/12/20/openscad-is-kinda-neat/,2025-12-21 02:25:19,hacker_news
MIRA – An open-source persistent AI entity with memory,63,31,https://github.com/taylorsatula/mira-OSS,2025-12-21 02:25:20,hacker_news
Biscuit is a specialized PostgreSQL index for fast pattern matching LIKE queries,70,10,https://github.com/CrystallineCore/Biscuit,2025-12-21 02:25:20,hacker_news
Perfecting Steve Baer's Triple Dome,5,0,https://vorth.github.io/vzome-sharing/2024/02/18/baer-dome-from-H4-1001-09-13-04.html,2025-12-21 02:25:20,hacker_news
More databases should be single-threaded,28,15,https://blog.konsti.xyz/p/8c8a399f-8cfe-47dd-9278-9527105d07dc/,2025-12-21 02:25:20,hacker_news
How to Write a 21st Century Proof (2011) [pdf],14,0,https://lamport.azurewebsites.net/pubs/proof.pdf,2025-12-21 02:25:20,hacker_news
Why do people leave comments on OpenBenches?,100,6,https://shkspr.mobi/blog/2025/12/why-do-people-leave-comments-on-openbenches/,2025-12-21 02:25:20,hacker_news
X-59 3D Printing,49,8,https://www.nasa.gov/stem-content/x-59-3d-printing/,2025-12-21 02:25:20,hacker_news
Approaching 50 Years of String Theory,51,99,https://www.math.columbia.edu/~woit/wordpress/?p=15401,2025-12-21 02:25:21,hacker_news
Measuring AI Ability to Complete Long Tasks: Opus 4.5 has 50% horizon of 4h49M,77,50,https://metr.org/blog/2025-03-19-measuring-ai-ability-to-complete-long-tasks/,2025-12-21 06:41:01,hacker_news
From devastation to wonder as Kangaroo Island bushfires lead to cave discoveries,31,2,https://www.abc.net.au/news/2025-12-13/more-than-150-caves-discovered-in-ki-after-devastating-bushfires/106095942,2025-12-21 06:41:02,hacker_news
Chomsky and the Two Cultures of Statistical Learning,38,19,https://norvig.com/chomsky.html,2025-12-21 06:41:02,hacker_news
What's New in Python 3.15,23,1,https://docs.python.org/3.15/whatsnew/3.15.html,2025-12-21 06:41:03,hacker_news
Waymo halts service during S.F. blackout after causing traffic jams,33,18,https://missionlocal.org/2025/12/sf-waymo-halts-service-blackout/,2025-12-21 06:41:03,hacker_news
You have reached the end of the internet (2006),134,33,https://hmpg.net/,2025-12-21 06:41:03,hacker_news
PG&E outages in S.F. leave 130k without electricity,41,24,https://www.sfchronicle.com/sf/article/pg-e-outage-40-000-customers-without-power-21254326.php,2025-12-21 06:41:03,hacker_news
New mathematical framework reshapes debate over simulation hypothesis,24,12,https://www.santafe.edu/news-center/news/new-mathematical-framework-reshapes-debate-over-simulation-hypothesis,2025-12-21 12:54:36,hacker_news
Show HN: Shittp – Volatile Dotfiles over SSH,8,2,https://github.com/FOBshippingpoint/shittp,2025-12-21 12:54:38,hacker_news
Ruby website redesigned,150,38,https://www.ruby-lang.org/en/,2025-12-21 12:54:40,hacker_news
Backing up Spotify,1362,457,https://annas-archive.li/blog/backing-up-spotify.html,2025-12-21 12:54:40,hacker_news
Measuring AI Ability to Complete Long Tasks,160,102,https://metr.org/blog/2025-03-19-measuring-ai-ability-to-complete-long-tasks/,2025-12-21 12:54:40,hacker_news
Indoor tanning makes youthful skin much older on a genetic level,80,38,https://www.ucsf.edu/news/2025/12/431206/indoor-tanning-makes-youthful-skin-much-older-genetic-level,2025-12-21 12:54:40,hacker_news
Luigi Pirandello's Broken Men,6,0,https://www.thenation.com/article/culture/luigi-pirandello-one-none-grand-review/,2025-12-21 12:54:41,hacker_news
William Golding's Island of Savagery,6,1,https://www.historytoday.com/archive/portrait-author-historian/william-goldings-island-savagery,2025-12-21 12:54:41,hacker_news
Isengard in Oxford,64,7,https://lareviewofbooks.org/article/isengard-in-oxford/,2025-12-21 12:54:42,hacker_news
Inca Stone Masonry,56,12,https://www.earthasweknowit.com/pages/inca_construction,2025-12-21 12:54:43,hacker_news
The uncertain origins of aspirin,15,2,https://www.asimov.press/p/aspirin,2025-12-21 12:54:47,hacker_news
I made a network throttle tool controlled by a Chrome extension,7,0,https://github.com/harrylincoln/taper,2025-12-21 12:54:48,hacker_news
Getting serial port output on modern Macs,11,0,https://gist.github.com/dhinakg/3fcd9ad43c82c96964b4f64eb05e6a5e,2025-12-21 12:54:49,hacker_news
Flock and Cyble Inc. weaponize “cybercrime” takedowns to silence critics,479,83,https://haveibeenflocked.com/news/cyble-downtime,2025-12-21 12:54:49,hacker_news
Chomsky and the Two Cultures of Statistical Learning (2011),77,57,https://norvig.com/chomsky.html,2025-12-21 12:54:51,hacker_news
Clair Obscur having its Indie Game Game Of The Year award stripped due to AI use,82,169,https://www.thegamer.com/clair-obscur-expedition-33-indie-game-awards-goty-stripped-ai-use/,2025-12-21 12:54:51,hacker_news
Show HN: Books mentioned on Hacker News in 2025,113,53,https://hackernews-readings-613604506318.us-west1.run.app,2025-12-21 18:37:49,hacker_news
E.W.Dijkstra Archive,56,4,https://www.cs.utexas.edu/~EWD/welcome.html,2025-12-21 18:37:49,hacker_news
I Program on the Subway,58,37,https://www.scd31.com/posts/programming-on-the-subway,2025-12-21 18:37:49,hacker_news
Logging Sucks,6,1,https://loggingsucks.com/,2025-12-21 18:37:49,hacker_news
ARIN Public Incident Report – 4.10 Misissuance Error,95,18,https://www.arin.net/announcements/20251212/,2025-12-21 18:37:49,hacker_news
ELF Crimes: Program Interpreter Fun,29,7,https://nytpu.com/gemlog/2025-12-21,2025-12-21 18:37:50,hacker_news
Coarse Is Better,126,64,https://borretti.me/article/coarse-is-better,2025-12-21 18:37:50,hacker_news
Show HN: WalletWallet – create Apple passes from anything,118,51,https://walletwallet.alen.ro/,2025-12-21 18:37:50,hacker_news
Three Ways to Solve Problems,55,13,https://andreasfragner.com/writing/three-ways-to-solve-problems,2025-12-21 18:37:50,hacker_news
Reasons Not to Become Famous (2020),111,77,https://tim.blog/2020/02/02/reasons-to-not-become-famous/,2025-12-21 18:37:50,hacker_news
Waymo suspends service in San Francisco as robotaxis stall during blackout,33,18,https://techcrunch.com/2025/12/21/waymo-suspends-service-in-san-francisco-as-robotaxis-stall-during-blackout/,2025-12-21 18:37:50,hacker_news
Structured Outputs Create False Confidence,65,41,https://boundaryml.com/blog/structured-outputs-create-false-confidence,2025-12-21 18:37:51,hacker_news
"Mountain home near Aspen, built for monks, sold to Palantir CEO for $120M",21,4,https://coloradosun.com/2025/12/19/monastery-sells-palantir-ceo/,2025-12-21 18:37:51,hacker_news
"Show HN: RenderCV – Open-source CV/resume generator, YAML → PDF",35,20,https://github.com/rendercv/rendercv,2025-12-21 18:37:51,hacker_news
What I Learned About Deploying AV1 from Two Deployers,20,15,https://streaminglearningcenter.com/articles/what-i-learned-about-deploying-av1-from-two-deployers.html,2025-12-21 18:37:51,hacker_news
CO2 Batteries That Store Grid Energy Take Off Globally,9,0,https://spectrum.ieee.org/co2-battery-energy-storage,2025-12-21 18:37:51,hacker_news
Decompiling the New C# 14 field Keyword,52,19,https://blog.ivankahl.com/decompiling-the-new-csharp-14-field-keyword/,2025-12-21 18:37:51,hacker_news
"Show HN: The Official National Train Map Sucked, So I Made My Own",50,12,https://www.bdzmap.com/,2025-12-21 18:37:51,hacker_news
A guide to local coding models,226,109,https://www.aiforswes.com/p/you-dont-need-to-spend-100mo-on-claude,2025-12-22 02:24:20,hacker_news
I'm just having fun,160,48,https://jyn.dev/i-m-just-having-fun/,2025-12-22 02:24:21,hacker_news
"Disney Imagineering Debuts Next-Generation Robotic Character, Olaf",85,33,https://disneyparksblog.com/disney-experiences/robotic-olaf-marks-new-era-of-disney-innovation/,2025-12-22 02:24:21,hacker_news
Deliberate Internet Shutdowns,22,3,https://www.schneier.com/blog/archives/2025/12/deliberate-internet-shutdowns.html,2025-12-22 02:24:21,hacker_news
ONNX Runtime and CoreML May Silently Convert Your Model to FP16,19,2,https://ym2132.github.io/ONNX_MLProgram_NN_exploration,2025-12-22 02:24:21,hacker_news
The Going Dark initiative or ProtectEU is a Chat Control 3.0 attempt,469,147,https://mastodon.online/@mullvadnet/115742530333573065,2025-12-22 02:24:21,hacker_news
Show HN: Autograd.c – A tiny ML framework built from scratch,57,5,https://github.com/sueszli/autograd.c,2025-12-22 02:24:21,hacker_news
I program on the subway,176,112,https://www.scd31.com/posts/programming-on-the-subway,2025-12-22 02:24:21,hacker_news
CO2 batteries that store grid energy take off globally,147,125,https://spectrum.ieee.org/co2-battery-energy-storage,2025-12-22 02:24:22,hacker_news
Evaluating chain-of-thought monitorability,26,4,https://openai.com/index/evaluating-chain-of-thought-monitorability/,2025-12-22 02:24:22,hacker_news
"Autoland saves King Air, everyone reported safe",120,56,https://avbrief.com/autoland-saves-king-air-everyone-reported-safe/,2025-12-22 02:24:22,hacker_news
"You’re not burnt out, you’re existentially starving",222,230,https://neilthanedar.com/youre-not-burnt-out-youre-existentially-starving/,2025-12-22 02:24:22,hacker_news
"I can't upgrade to Windows 11, now leave me alone",363,333,https://idiallo.com/byte-size/cant-update-to-windows-11-leave-me-alone,2025-12-22 02:24:22,hacker_news
Evolution by Natural Induction,6,0,https://royalsocietypublishing.org/rsfs/article/15/6/20250025/366156/Evolution-by-natural-induction,2025-12-22 02:24:22,hacker_news
86Box v5.3,7,0,https://86box.net/2025/12/21/86box-v5-3.html,2025-12-22 02:24:22,hacker_news
"Rue: Higher level than Rust, lower level than Go",85,58,https://rue-lang.dev/,2025-12-22 02:24:23,hacker_news
Coarse is better,183,95,https://borretti.me/article/coarse-is-better,2025-12-22 02:24:23,hacker_news
Get an AI code review in 10 seconds,95,51,https://oldmanrahul.com/2025/12/19/ai-code-review-trick/,2025-12-22 02:24:23,hacker_news
Structured outputs create false confidence,118,59,https://boundaryml.com/blog/structured-outputs-create-false-confidence,2025-12-22 02:24:23,hacker_news
Webb observes exoplanet that may have an exotic helium and carbon atmosphere,36,5,https://science.nasa.gov/missions/webb/nasas-webb-observes-exoplanet-whose-composition-defies-explanation/,2025-12-22 06:47:15,hacker_news
Build Android apps using Rust and Iced,39,9,https://github.com/ibaryshnikov/android-iced-example,2025-12-22 06:47:15,hacker_news
Kernighan's Lever,32,9,https://linusakesson.net/programming/kernighans-lever/index.php,2025-12-22 06:47:15,hacker_news
Aliasing,8,0,https://xania.org/202512/15-aliasing-in-general,2025-12-22 06:47:15,hacker_news
"Show HN: Rust/WASM lighting data toolkit – parses legacy formats, generates SVGs",13,0,https://eulumdat.icu,2025-12-22 06:47:15,hacker_news
Exploring Speculative JIT Compilation for Emacs Lisp with Java,11,1,https://kyo.iroiro.party/en/posts/juicemacs-exploring-jit-for-elisp/,2025-12-22 06:47:15,hacker_news
Cursed circuits #3: true mathematics,6,1,https://lcamtuf.substack.com/p/cursed-circuits-3-true-mathematics,2025-12-22 06:47:15,hacker_news
Functional Flocking Quadtree in ClojureScript,11,0,https://www.lbjgruppen.com/en/posts/flocking-quadtrees,2025-12-22 06:47:15,hacker_news
Luke Howard’s essay on the modification of clouds (1865),6,0,https://publicdomainreview.org/collection/essay-on-the-modification-of-clouds/,2025-12-22 06:47:16,hacker_news
"If You Don't Design Your Career, Someone Else Will",119,68,https://gregmckeown.com/if-you-dont-design-your-career-someone-else-will/,2025-12-22 12:58:43,hacker_news
The ancient monuments saluting the winter solstice,53,33,https://www.bbc.com/culture/article/20251219-the-ancient-monuments-saluting-the-winter-solstice,2025-12-22 12:58:43,hacker_news
Programming languages used for music,79,25,https://timthompson.com/plum/cgi/showlist.cgi?sort=name&concise=yes,2025-12-22 12:58:43,hacker_news
How I protect my Forgejo instance from AI web crawlers,56,39,https://her.esy.fun/posts/0031-how-i-protect-my-forgejo-instance-from-ai-web-crawlers/index.html,2025-12-22 12:58:44,hacker_news
Well Being in Times of Algorithms,22,13,https://www.ssp.sh/blog/well-being-algorithms/,2025-12-22 12:58:44,hacker_news
Show HN: Backlog – a public repository of real work problems,29,7,https://www.worldsbacklog.com/,2025-12-22 12:58:44,hacker_news
Cartoon Network channel errors (1995 – 2025),19,5,https://cnas.fandom.com/wiki/Channel_Errors,2025-12-22 12:58:45,hacker_news
A Year of Vibes,6,0,https://lucumr.pocoo.org/2025/12/22/a-year-of-vibes/,2025-12-22 12:58:45,hacker_news
More on whether useful quantum computing is “imminent”,98,82,https://scottaaronson.blog/?p=9425,2025-12-22 12:58:45,hacker_news
Decompiling the Synergy: Human–LLM Teaming in Reverse Engineering [pdf],3,0,https://www.zionbasque.com/files/papers/dec-synergy-study.pdf,2025-12-22 12:58:46,hacker_news
Lightning: Real-time editing for tiled map data,15,3,https://felt.com/blog/lightning-tiles,2025-12-22 12:58:46,hacker_news
Scaling LLMs to Larger Codebases,113,60,https://blog.kierangill.xyz/oversight-and-guidance,2025-12-22 18:41:43,hacker_news
Claude Code gets native LSP support,73,27,https://github.com/anthropics/claude-code/blob/main/CHANGELOG.md,2025-12-22 18:41:43,hacker_news
Benn Jordan – This Flock Camera Leak Is Like Netflix for Stalkers [video],140,60,https://www.youtube.com/watch?v=vU1-uiUlHTo,2025-12-22 18:41:43,hacker_news
The biggest CRT ever made: Sony's PVM-4300,167,106,https://dfarq.homeip.net/the-biggest-crt-ever-made-sonys-pvm-4300/,2025-12-22 18:41:43,hacker_news
Jimmy Lai Is a Martyr for Freedom,142,52,https://reason.com/2025/12/19/jimmy-lai-is-a-martyr-for-freedom/,2025-12-22 18:41:43,hacker_news
AI Bathroom Monitors? Welcome to America's New Surveillance High Schools,52,17,https://www.forbes.com/sites/thomasbrewster/2025/12/16/ai-bathroom-monitors-welcome-to-americas-new-surveillance-high-schools/,2025-12-22 18:41:43,hacker_news
Henge Finder,10,2,https://hengefinder.rcdis.co/#learn,2025-12-22 18:41:43,hacker_news
A year of vibes,141,75,https://lucumr.pocoo.org/2025/12/22/a-year-of-vibes/,2025-12-22 18:41:43,hacker_news
Uplane (YC F25) Is Hiring Founding Engineers (Full-Stack and AI),1,0,https://www.useparallel.com/uplane1/careers,2025-12-22 18:41:44,hacker_news
NIST was 5 μs off UTC after last week's power cut,9,4,https://www.jeffgeerling.com/blog/2025/nist-was-5-μs-utc-after-last-weeks-power-cut,2025-12-22 18:41:44,hacker_news
Microsoft will kill obsolete cipher that has wreaked decades of havoc,101,57,https://arstechnica.com/security/2025/12/microsoft-will-finally-kill-obsolete-cipher-that-has-wreaked-decades-of-havoc/,2025-12-22 18:41:44,hacker_news
Show HN: Netrinos – A keep it simple Mesh VPN for small teams,67,31,https://netrinos.com,2025-12-22 18:41:44,hacker_news
There's no such thing as a fake feather [video],42,12,https://www.youtube.com/watch?v=N5yV1Q9O6r4,2025-12-22 18:41:44,hacker_news
Debian's Git Transition,126,37,https://diziet.dreamwidth.org/20436.html,2025-12-22 18:41:44,hacker_news
Your Supabase Is Public,13,3,https://skilldeliver.com/your-supabase-is-public,2025-12-22 18:41:44,hacker_news
Show HN: An easy way of broadcasting radio around you (looking for feedback),14,0,https://github.com/dpipstudio/botwave,2025-12-22 18:41:44,hacker_news
Let's write a toy UI library,3,0,https://nakst.gitlab.io/tutorial/ui-part-1.html,2025-12-22 18:41:45,hacker_news
"If you don't design your career, someone else will (2014)",320,168,https://gregmckeown.com/if-you-dont-design-your-career-someone-else-will/,2025-12-22 18:41:45,hacker_news
Flock Exposed Its AI-Powered Cameras to the Internet. We Tracked Ourselves,51,22,https://www.404media.co/flock-exposed-its-ai-powered-cameras-to-the-internet-we-tracked-ourselves/,2025-12-22 18:41:45,hacker_news
Snitch – A friendlier ss/netstat,111,17,https://github.com/karol-broda/snitch,2025-12-23 06:46:56,hacker_news
FCC Updates Covered List to Include Foreign UAS and UAS Critical Components [pdf],52,25,https://docs.fcc.gov/public/attachments/DOC-416839A1.pdf,2025-12-23 06:46:56,hacker_news
The Illustrated Transformer,337,71,https://jalammar.github.io/illustrated-transformer/,2025-12-23 06:46:56,hacker_news
It's Always TCP_NODELAY,238,63,https://brooker.co.za/blog/2024/05/09/nagle.html,2025-12-23 06:46:57,hacker_news
Show HN: CineCLI – Browse and torrent movies directly from your terminal,5,1,https://github.com/eyeblech/cinecli,2025-12-23 06:46:57,hacker_news
Ultrasound Cancer Treatment: Sound Waves Fight Tumors,234,64,https://spectrum.ieee.org/ultrasound-cancer-treatment,2025-12-23 06:46:57,hacker_news
"The Duodecimal Bulletin, Vol. 55, No. 1, Year 1209 [pdf]",16,0,https://dozenal.org/drupal/sites_bck/default/files/DuodecimalBulletinIssue551.pdf,2025-12-23 06:46:57,hacker_news
GLM-4.7: Advancing the Coding Capability,299,141,https://z.ai/blog/glm-4.7,2025-12-23 06:46:57,hacker_news
Our New Sam Audio Model Transforms Audio Editing,70,22,https://about.fb.com/news/2025/12/our-new-sam-audio-model-transforms-audio-editing/,2025-12-23 06:46:57,hacker_news
The Polyglot NixOS,11,0,https://x86.lol/generic/2025/12/19/polyglot.html,2025-12-23 06:46:57,hacker_news
The Garbage Collection Handbook,185,12,https://gchandbook.org/index.html,2025-12-23 06:46:58,hacker_news
FPGAs Need a New Future,134,86,https://www.allaboutcircuits.com/industry-articles/fpgas-need-a-new-future/,2025-12-23 06:46:58,hacker_news
Show HN: C-compiler to compile TCC for live-bootstrap,43,7,https://github.com/FransFaase/MES-replacement,2025-12-23 06:46:58,hacker_news
Plugins case study: mdBook preprocessors,12,2,https://eli.thegreenplace.net/2025/plugins-case-study-mdbook-preprocessors/,2025-12-23 06:46:58,hacker_news
Universal Reasoning Model (53.8% pass 1 ARC1 and 16.0% ARC 2),88,12,https://arxiv.org/abs/2512.14693,2025-12-23 06:46:58,hacker_news
How the RESISTORS put computing into 1960s counter-culture,55,7,https://spectrum.ieee.org/teenage-hackers,2025-12-23 06:46:58,hacker_news
Lotusbail npm package found to be harvesting WhatsApp messages and contacts,254,157,https://www.koi.ai/blog/npm-package-with-56k-downloads-malware-stealing-whatsapp-messages,2025-12-23 06:46:59,hacker_news
Show HN: Python SDK – forecasting with foundation time-series and tabular models,9,1,https://github.com/S-FM/faim-python-client,2025-12-23 06:46:59,hacker_news
Remove Black Color with Shaders,13,2,https://yuanchuan.dev/remove-black-color-with-shaders,2025-12-23 06:46:59,hacker_news
Satellites reveal heat leaking from largest US cryptocurrency mining center,111,92,https://www.space.com/space-exploration/satellites/satellites-reveal-heat-leaking-from-largest-us-cryptocurrency-mining-center,2025-12-23 06:46:59,hacker_news
Adobe Photoshop 1.0 Source Code (1990),167,44,https://computerhistory.org/blog/adobe-photoshop-source-code/,2025-12-23 13:00:34,hacker_news
Instant database clones with PostgreSQL 18,89,11,https://boringsql.com/posts/instant-database-clones/,2025-12-23 13:00:34,hacker_news
Font with Built-In Syntax Highlighting (2024),26,5,https://blog.glyphdrawing.club/font-with-built-in-syntax-highlighting/,2025-12-23 13:00:34,hacker_news
Carnap – A formal logic framework for Haskell,43,9,https://carnap.io/,2025-12-23 13:00:34,hacker_news
Postponed '60 Minutes' segment on Salvadoran prison is streamed by Canadian news,21,1,https://www.nbcnews.com/news/us-news/cbs-news-el-salvador-cecot-prison-sharyn-alfonsi-bari-weiss-rcna250618,2025-12-23 13:00:34,hacker_news
10 years bootstrapped: €6.5M revenue with a team of 13,58,16,https://www.datocms.com/blog/a-look-back-at-2025,2025-12-23 13:00:35,hacker_news
Debian adds LoongArch as officially supported architecture,89,20,https://lists.debian.org/debian-devel-announce/2025/12/msg00004.html,2025-12-23 13:00:35,hacker_news
Ask HN: What are the best engineering blogs with real-world depth?,79,47,https://news.ycombinator.com/item?id=46363921,2025-12-23 13:00:35,hacker_news
Solving the Problems of HBM-on-Logic,4,0,https://morethanmoore.substack.com/p/solving-the-problems-of-hbm-on-logic,2025-12-23 13:00:35,hacker_news
A centennial look back at Edward Gorey's macabre art and guarded life,23,2,https://www.washingtonpost.com/books/2025/12/13/edward-gorey-centennial-gregory-hischak-review/,2025-12-23 13:00:35,hacker_news
Fabrice Bellard Releases MicroQuickJS,211,42,https://github.com/bellard/mquickjs/blob/main/README.md,2025-12-23 18:41:48,hacker_news
We replaced H.264 streaming with JPEG screenshots (and it worked better),17,5,https://blog.helix.ml/p/we-mass-deployed-15-year-old-screen,2025-12-23 18:41:48,hacker_news
Meta is using the Linux scheduler designed for Valve's Steam Deck on its servers,166,56,https://www.phoronix.com/news/Meta-SCX-LAVD-Steam-Deck-Server,2025-12-23 18:41:48,hacker_news
"Test, don't (just) verify",144,87,https://alperenkeles.com/posts/test-dont-verify/,2025-12-23 18:41:48,hacker_news
