title,upvotes,comments,link,post_time,platform
ManusAI Joins Meta,121,67,https://manus.im/blog/manus-joins-meta-for-next-era-of-innovation,2025-12-30 02:20:22,hacker_news
Intelligence – A Mystery Investigation Game,20,1,https://intelligencegame.tech/,2025-12-30 02:20:22,hacker_news
Stanford Lecture: Dr. Don Knuth – Adventures with Knight's Tours [video],20,2,https://www.youtube.com/watch?v=MKiRte-tnMY,2025-12-30 02:20:22,hacker_news
Show HN: A 45x45 Connections Puzzle To Commemorate 2025=45*45,15,5,https://thomaswc.com/2025.html,2025-12-30 02:20:23,hacker_news
GOG is getting acquired by its original co-founder,596,341,https://www.gog.com/blog/gog-is-getting-acquired-by-its-original-co-founder-what-it-means-for-you/,2025-12-30 06:44:57,hacker_news
Hacking Washing Machines [video],70,18,https://media.ccc.de/v/39c3-hacking-washing-machines,2025-12-30 06:44:58,hacker_news
Stranger Things creator says turn off garbage settings,109,141,https://screenrant.com/stranger-things-creator-turn-off-settings-premiere/,2025-12-30 06:44:58,hacker_news
The future of software development is software developers,123,103,https://codemanship.wordpress.com/2025/11/25/the-future-of-software-development-is-software-developers/,2025-12-30 06:44:59,hacker_news
Show HN: A Claude Code plugin that catch destructive Git and filesystem commands,30,31,https://github.com/kenryu42/claude-code-safety-net,2025-12-30 06:44:59,hacker_news
Streaming compression beats framed compression,12,7,https://bou.ke/blog/compressed/,2025-12-30 06:44:59,hacker_news
AI is forcing us to write good code,140,101,https://bits.logic.inc/p/ai-is-forcing-us-to-write-good-code,2025-12-30 06:44:59,hacker_news
Show HN: Euclidle – Guess the Coordinates in N‑Dimensional Space,5,1,https://euclidle.com/,2025-12-30 06:45:00,hacker_news
Karpathy on Programming: “I've never felt this much behind”,389,437,https://twitter.com/karpathy/status/2004607146781278521,2025-12-30 06:45:01,hacker_news
Netflix: Open Content,153,19,https://opencontent.netflix.com/,2025-12-30 13:00:43,hacker_news
Non-Zero-Sum Games,51,3,https://nonzerosum.games/,2025-12-30 13:00:43,hacker_news
Go Away Python,104,42,https://lorentz.app/blog-item.html?id=go-shebang,2025-12-30 13:00:43,hacker_news
"Nicolas Guillou, French ICC judge sanctioned by the US and “debanked”",129,63,https://www.lemonde.fr/en/international/article/2025/11/19/nicolas-guillou-french-icc-judge-sanctioned-by-the-us-you-are-effectively-blacklisted-by-much-of-the-world-s-banking-system_6747628_4.html,2025-12-30 13:00:43,hacker_news
"Show HN: One clean, developer-focused page for every Unicode symbol",65,32,https://fontgenerator.design/symbols,2025-12-30 13:00:43,hacker_news
Crimson (YC X25) is hiring founding engineers in London,1,0,https://www.ycombinator.com/companies/crimson/jobs/kCikzj1-founding-engineer-full-stack,2025-12-30 13:00:43,hacker_news
UNIX Fourth Edition,64,7,http://squoze.net/UNIX/v4/README,2025-12-30 13:00:44,hacker_news
Graph Algorithms in Rayon,16,0,https://davidlattimore.github.io/posts/2025/11/27/graph-algorithms-in-rayon.html,2025-12-30 13:00:44,hacker_news
Turning an old Amazon Kindle into a eInk development platform (2021),27,4,https://blog.lidskialf.net/2021/02/08/turning-an-old-kindle-into-a-eink-development-platform/,2025-12-30 13:00:44,hacker_news
Charm Ruby – Glamorous Terminal Libraries for Ruby,23,2,https://charm-ruby.dev/,2025-12-30 13:00:44,hacker_news
Easily Dealing with Any-Dimensional Planes,3,0,https://gpfault.net/posts/hyperplanes.html,2025-12-30 13:00:44,hacker_news
Librarians Tired of Being Accused of Hiding Secret Books That Were Made Up by AI,63,42,https://gizmodo.com/librarians-arent-hiding-secret-books-from-you-that-only-ai-knows-about-2000698176,2025-12-30 13:00:44,hacker_news
Toro: Deploy Applications as Unikernels,52,19,https://github.com/torokernel/torokernel,2025-12-30 18:42:43,hacker_news
Reverse Engineering a Mysterious UDP Stream in My Hotel (2016),78,9,https://www.gkbrk.com/hotel-music,2025-12-30 18:42:43,hacker_news
Igniting the GPU: From Kernel Plumbing to 3D Rendering on RISC-V,28,2,https://mwilczynski.dev/posts/riscv-gpu-zink/,2025-12-30 18:42:43,hacker_news
Electrolysis can solve one of our biggest contamination problems,10,0,https://ethz.ch/en/news-and-events/eth-news/news/2025/11/electrolysis-can-solve-one-of-our-biggest-contamination-problems.html,2025-12-30 18:42:43,hacker_news
Loss32: Let's Build a Win32/Linux,37,155,https://loss32.org/,2025-12-30 18:42:43,hacker_news
The British empire's resilient subsea telegraph network,101,17,https://subseacables.blogspot.com/2025/12/the-british-empires-resilient-subsea.html,2025-12-30 18:42:43,hacker_news
Show HN: 22 GB of hacker news in SQLite,13,4,https://hackerbook.dosaygo.com,2025-12-30 18:42:43,hacker_news
Times New American: A Tale of Two Fonts,136,78,https://hsu.cy/2025/12/times-new-american/,2025-12-30 18:42:43,hacker_news
Approachable Swift Concurrency,107,47,https://fuckingapproachableswiftconcurrency.com/en/,2025-12-30 18:42:43,hacker_news
America's economy looks set to accelerate,3,0,https://www.economist.com/finance-and-economics/2025/12/30/americas-economy-looks-set-to-accelerate,2025-12-30 18:42:44,hacker_news
What Happened to Abit Motherboards,33,32,https://dfarq.homeip.net/what-happened-to-abit-motherboards/,2025-12-30 18:42:44,hacker_news
Postgres extension complements pgvector for performance and scale,81,12,https://github.com/timescale/pgvectorscale,2025-12-30 18:42:44,hacker_news
Hive (YC S14) Is Hiring a Staff Software Engineer (Data Systems),1,0,https://jobs.ashbyhq.com/hive.co/cb0dc490-0e32-4734-8d91-8b56a31ed497,2025-12-30 18:42:44,hacker_news
Show HN: Tidy Baby is a SET game but with words,12,4,https://tidy.baby,2025-12-30 18:42:44,hacker_news
Netflix Open Content,477,89,https://opencontent.netflix.com/,2025-12-30 18:42:44,hacker_news
Go away Python,243,224,https://lorentz.app/blog-item.html?id=go-shebang,2025-12-30 18:42:44,hacker_news
No strcpy either,158,75,https://daniel.haxx.se/blog/2025/12/29/no-strcpy-either/,2025-12-30 18:42:45,hacker_news
Concurrent Hash Table Designs,40,2,https://bluuewhale.github.io/posts/concurrent-hashmap-designs/,2025-12-30 18:42:45,hacker_news
Project ideas to appreciate the art of programming,128,39,https://codecrafters.io/blog/programming-project-ideas,2025-12-31 02:20:35,hacker_news
A faster heart for F-Droid,278,119,https://f-droid.org/2025/12/30/a-faster-heart-for-f-droid.html,2025-12-31 02:20:35,hacker_news
FediMeteo: A €4 FreeBSD VPS Became a Global Weather Service,227,54,https://it-notes.dragas.net/2025/02/26/fedimeteo-how-a-tiny-freebsd-vps-became-a-global-weather-service-for-thousands/,2025-12-31 02:20:35,hacker_news
Quality of drinking water varies significantly by airline,37,12,https://foodmedcenter.org/2026-center-for-food-as-medicine-longevity-airline-water-study/,2025-12-31 02:20:35,hacker_news
Show HN: 22 GB of Hacker News in SQLite,328,105,https://hackerbook.dosaygo.com,2025-12-31 02:20:35,hacker_news
A Vulnerability in Libsodium,207,25,https://00f.net/2025/12/30/libsodium-vulnerability/,2025-12-31 02:20:35,hacker_news
Zpdf: PDF text extraction in Zig – 5x faster than MuPDF,119,46,https://github.com/Lulzx/zpdf,2025-12-31 02:20:35,hacker_news
OpenAI's cash burn will be one of the big bubble questions of 2026,188,244,https://www.economist.com/leaders/2025/12/30/openais-cash-burn-will-be-one-of-the-big-bubble-questions-of-2026,2025-12-31 02:20:35,hacker_news
Mitsubishi Diatone D-160 (1985),19,10,https://audio-database.com/MITSUBISHI-DIATONE/diatonesp/d-160-e.html,2025-12-31 02:20:35,hacker_news
Honey's Dieselgate: Detecting and tricking testers,114,23,https://vptdigital.com/blog/honey-detecting-testers/,2025-12-31 02:20:36,hacker_news
Escaping containment: A security analysis of FreeBSD jails [video],53,1,https://media.ccc.de/v/39c3-escaping-containment-a-security-analysis-of-freebsd-jails,2025-12-31 02:20:36,hacker_news
"Professional software developers don't vibe, they control",108,151,https://arxiv.org/abs/2512.14012,2025-12-31 02:20:36,hacker_news
Everything as code: How we manage our company in one monorepo,179,166,https://www.kasava.dev/blog/everything-as-code-monorepo,2025-12-31 02:20:36,hacker_news
Sabotaging Bitcoin,80,47,https://blog.dshr.org/2025/12/sabotaging-bitcoin.html,2025-12-31 02:20:36,hacker_news
Humans May Be Able to Grow New Teeth Within Just 4 Years,89,40,https://www.popularmechanics.com/science/health/a69878870/human-new-tooth-regrowth-trials-japan-timeline/,2025-12-31 02:20:37,hacker_news
Animated AI,95,10,https://animatedai.github.io/,2025-12-31 06:45:56,hacker_news
Readings in Database Systems (5th Edition),59,3,http://www.redbook.io/,2025-12-31 06:45:56,hacker_news
Odin: Moving Towards a New core:OS,16,0,https://odin-lang.org/news/moving-towards-a-new-core-os/,2025-12-31 06:45:56,hacker_news
Google Opal,68,34,https://opal.google/landing/,2025-12-31 06:45:56,hacker_news
LLVM AI tool policy: human in the loop,167,78,https://discourse.llvm.org/t/rfc-llvm-ai-tool-policy-human-in-the-loop/89159,2025-12-31 06:45:57,hacker_news
Zpdf: PDF text extraction in Zig,162,57,https://github.com/Lulzx/zpdf,2025-12-31 06:45:57,hacker_news
What If Heavy Files Felt Heavy?,32,19,https://www.shiveesh.com/thoughts-and-ideas/what-if-heavy-files-actually-felt-heavy,2025-12-31 06:45:57,hacker_news
"Git analytics that works across GitHub, GitLab, and Bitbucket",7,5,https://news.ycombinator.com/item?id=46419311,2025-12-31 06:45:58,hacker_news
Akin's Laws of Spacecraft Design [pdf],52,6,https://www.ece.uvic.ca/~elec399/201409/Akin%27s%20Laws%20of%20Spacecraft%20Design.pdf,2025-12-31 12:58:49,hacker_news
"Show HN: Use Claude Code to Query 600 GB Indexes over Hacker News, ArXiv, etc.",109,26,https://exopriors.com/scry,2025-12-31 12:58:49,hacker_news
Fifteen Most Famous Transcendental Numbers,5,0,https://sprott.physics.wisc.edu/pickover/trans.html,2025-12-31 12:58:49,hacker_news
Tixl: Open-source realtime motion graphics,85,11,https://github.com/tixl3d/tixl,2025-12-31 12:58:49,hacker_news
The rise of industrial software,116,87,https://chrisloy.dev/post/2025/12/30/the-rise-of-industrial-software,2025-12-31 12:58:49,hacker_news
Activeloop (YC S18) Is Hiring MTS – Back End Engineer,1,0,https://careers.activeloop.ai/?ashby_jid=d8c54147-5fc8-48ba-a097-a6ae046c42bd,2025-12-31 12:58:49,hacker_news
Doom in Django: testing the limits of LiveView at 600.000 divs/segundo,45,11,https://en.andros.dev/blog/7b1b607b/doom-in-django-testing-the-limits-of-liveview-at-600000-divssegundo/,2025-12-31 12:58:49,hacker_news
Show HN: I built a universal clipboard that syncs realtime on multiple devices,13,19,https://www.quickclip.space/,2025-12-31 12:58:49,hacker_news
'Three norths' alignment about to end,36,15,https://www.spatialsource.com.au/three-norths-alignment-about-to-end/,2025-12-31 12:58:49,hacker_news
Readings in Database Systems (5th Edition) (2015),112,9,http://www.redbook.io/,2025-12-31 12:58:49,hacker_news
Kitchen Optimizations,15,19,https://www.natemeyvis.com/kitchen-optimizations/,2025-12-31 12:58:50,hacker_news
The Organists Improvising Soundtracks to Silent Films,7,2,https://www.newyorker.com/magazine/2025/12/29/the-organists-improvising-soundtracks-to-silent-films,2025-12-31 12:58:50,hacker_news
The compiler is your best friend,62,26,https://blog.daniel-beskin.com/2025-12-22-the-compiler-is-your-best-friend-stop-lying-to-it,2025-12-31 18:40:02,hacker_news
Scaffolding to Superhuman: How Curriculum Learning Solved 2048 and Tetris,74,13,https://kywch.github.io/blog/2025/12/curriculum-learning-2048-tetris/,2025-12-31 18:40:02,hacker_news
Microtonal Spiral Piano,14,5,https://shih1.github.io/spiral/,2025-12-31 18:40:02,hacker_news
2026: The Year of Java in the Terminal?,63,90,https://xam.dk/blog/lets-make-2026-the-year-of-java-in-the-terminal/,2025-12-31 18:40:02,hacker_news
When square pixels aren't square,55,26,https://alexwlchan.net/2025/square-pixels/,2025-12-31 18:40:02,hacker_news
Stardew Valley developer made a $125k donation to the FOSS C# framework MonoGame,383,150,https://monogame.net/blog/2025-12-30-385-new-sponsor-announcement/,2025-12-31 18:40:02,hacker_news
"SigNoz (YC W21, open source observability platform) Is Hiring across roles",1,0,https://signoz.io/careers,2025-12-31 18:40:02,hacker_news
"Back to the future: the story of Squeak, a practical Smalltalk written in itself [pdf] (1997)",64,8,http://www.vpri.org/pdf/tr1997001_backto.pdf,2025-12-31 18:40:03,hacker_news
"Stewart Cheifet, creator of The Computer Chronicles, dead at 87",13,6,https://obits.goldsteinsfuneral.com/stewart-cheifet,2025-12-31 18:40:03,hacker_news
Efficient method to capture carbon dioxide from the atmosphere,201,194,https://www.helsinki.fi/en/news/innovations/efficient-method-capture-carbon-dioxide-atmosphere-developed-university-helsinki,2025-12-31 18:40:03,hacker_news
RoboCop – Breaking the Law. H0ffman Cracks RoboCop Arcade from DataEast,49,3,https://hoffman.home.blog/2025/12/26/robocop-breaking-the-law/,2025-12-31 18:40:03,hacker_news
France targets Australia-style social media ban for children next year,68,77,https://www.theguardian.com/world/2025/dec/31/france-plans-social-media-ban-for-under-15s-from-september-2026,2025-12-31 18:40:03,hacker_news
Winnie-the-Pooh brings 100 years of fame to forest,42,11,https://www.bbc.com/news/articles/c4g9dzj1xj3o,2025-12-31 18:40:03,hacker_news
"Nvidia GB10's Memory Subsystem, from the CPU Side",24,4,https://chipsandcheese.com/p/inside-nvidia-gb10s-memory-subsystem,2025-12-31 18:40:03,hacker_news
The Economics of Duke University,26,8,https://dontaylor13.substack.com/p/duke-university,2025-12-31 18:40:04,hacker_news
Show HN: LoongArch Userspace Emulator,34,11,https://github.com/libriscv/libloong,2025-12-31 18:40:04,hacker_news
Meta created 'playbook' to fend off pressure to crack down on scammers,7,2,https://www.reuters.com/investigations/meta-created-playbook-fend-off-pressure-crack-down-scammers-documents-show-2025-12-31/,2025-12-31 18:40:04,hacker_news
Who Invented the Transistor?,32,22,https://people.idsia.ch/~juergen/who-invented-the-transistor.html,2025-12-31 18:40:04,hacker_news
Court report detailing ChatGPT's involvement with a recent murder suicide [pdf],11,2,https://storage.courtlistener.com/recap/gov.uscourts.cand.461878/gov.uscourts.cand.461878.1.0.pdf,2025-12-31 18:40:04,hacker_news
2025: The Year in LLMs,119,60,https://simonwillison.net/2025/Dec/31/the-year-in-llms/,2026-01-01 02:32:17,hacker_news
I canceled my book deal,338,224,https://austinhenley.com/blog/canceledbookdeal.html,2026-01-01 02:32:17,hacker_news
"Show HN: BusterMQ, Thread-per-core NATS server in Zig with io_uring",27,2,https://bustermq.sh/,2026-01-01 02:32:17,hacker_news
Scientists unlock brain's natural clean-up system for new treatments for stroke,70,12,https://www.monash.edu/pharm/about/news/news-listing/latest/scientists-unlock-brains-natural-clean-up-system-to-develop-new-treatments-for-stroke-and-other-neurological-diseases,2026-01-01 02:32:17,hacker_news
Warren Buffett steps down as Berkshire Hathaway CEO after six decades,385,237,https://www.latimes.com/business/story/2025-12-31/warren-buffett-steps-down-as-berkshire-hathaway-ceo-after-six-decades,2026-01-01 02:32:17,hacker_news
Resistance training load does not determine hypertrophy,55,55,https://physoc.onlinelibrary.wiley.com/doi/10.1113/JP289684,2026-01-01 02:32:17,hacker_news
Observed Agent Sandbox Bypasses,28,13,https://voratiq.com/blog/yolo-in-the-sandbox/,2026-01-01 02:32:17,hacker_news
All-optical synthesis chip for large-scale intelligent semantic vision,56,9,https://www.science.org/doi/10.1126/science.adv7434,2026-01-01 02:32:17,hacker_news
GoGoGrandparent (YC S16) Is Hiring Tech Leads,1,0,https://www.ycombinator.com/companies/gogograndparent/jobs/w2jGKM7-gogograndparent-yc-s16-is-hiring-tech-leads,2026-01-01 02:32:18,hacker_news
Demystifying DVDs,110,8,https://hiddenpalace.org/News/One_Bad_Ass_Hedgehog_-_Shadow_the_Hedgehog#Demystifying_DVDs,2026-01-01 02:32:18,hacker_news
On privacy and control,146,79,https://toidiu.com/blog/2025-12-25-privacy-and-control/,2026-01-01 02:32:18,hacker_news
My role as a founder-CTO: year 8,98,90,https://miguelcarranza.es/cto-year-8,2026-01-01 02:32:18,hacker_news
"Ÿnsect, a French insect farming startup, has been been placed into liquidation",67,72,https://techcrunch.com/2025/12/26/how-reality-crushed-ynsect-the-french-startup-that-had-raised-over-600m-for-insect-farming/,2026-01-01 02:32:18,hacker_news
"Nerd: A language for LLMs, not humans",31,57,https://www.nerd-lang.org/about,2026-01-01 02:32:18,hacker_news
PyPI in 2025: A Year in Review,46,11,https://blog.pypi.org/posts/2025-12-31-pypi-2025-in-review/,2026-01-01 02:32:18,hacker_news
The Delete Act,105,55,https://privacy.ca.gov/drop/about-drop-and-the-delete-act/,2026-01-01 02:32:18,hacker_news
Akin's Laws of Spacecraft Design (2011) [pdf],266,81,https://www.ece.uvic.ca/~elec399/201409/Akin%27s%20Laws%20of%20Spacecraft%20Design.pdf,2026-01-01 02:32:18,hacker_news
Web Browsers have stopped blocking pop-ups,63,52,https://www.smokingonabike.com/2025/12/31/web-browsers-have-stopped-blocking-pop-ups/,2026-01-01 02:32:18,hacker_news
The most famous transcendental numbers,141,84,https://sprott.physics.wisc.edu/pickover/trans.html,2026-01-01 02:32:18,hacker_news
Show HN: Frockly – A visual editor for understanding complex Excel formulas,40,9,https://news.ycombinator.com/item?id=46384322,2026-01-01 02:32:18,hacker_news
How AI labs are solving the power problem,125,202,https://newsletter.semianalysis.com/p/how-ai-labs-are-solving-the-power,2026-01-01 02:32:19,hacker_news
Flow5 released to open source,32,1,https://flow5.tech/docs/releasenotes.html,2026-01-01 06:45:43,hacker_news
Pixar's True Story,26,3,https://computerhistory.org/blog/pixars-true-story/,2026-01-01 06:45:43,hacker_news
Tell HN: Happy New Year,293,159,https://news.ycombinator.com/item?id=46443744,2026-01-01 06:45:43,hacker_news
Reminiscences of a Stock Operator (1923),12,6,https://gutenberg.org/cache/epub/60979/pg60979-images.html,2026-01-01 06:45:44,hacker_news
So I started cloning the Wii U gamepad [video],20,2,https://www.youtube.com/watch?v=jlbcKuDEBw8,2026-01-01 06:45:44,hacker_news
Build Software. Build Users,8,0,https://dima.day/blog/build-software-build-users/,2026-01-01 06:45:44,hacker_news
Iron Beam: Israel's first operational anti drone laser system,118,210,https://mod.gov.il/en/press-releases/press-room/israel-mod-and-rafael-deliver-first-operational-high-power-laser-system-iron-beam-to-the-idf,2026-01-01 06:45:44,hacker_news
Bluetooth Headphone Jacking: A Key to Your Phone [video],31,3,https://media.ccc.de/v/39c3-bluetooth-headphone-jacking-a-key-to-your-phone,2026-01-01 12:58:48,hacker_news
Windows 11 Outperforming Linux on an Intel Arrow Lake H Laptop,49,23,https://www.phoronix.com/review/windows-beats-linux-arl-h,2026-01-01 12:58:49,hacker_news
Pokémon Team Optimization,70,35,https://nchagnet.pages.dev/blog/pokemon-team-optimization/,2026-01-01 12:58:49,hacker_news
Easel Turns One One year of building my own IDE in Clojure,61,3,https://blog.phronemophobic.com/easel-one-year.html,2026-01-01 12:58:49,hacker_news
Rust–: Rust without the borrow checker,57,58,https://github.com/buyukakyuz/rustmm,2026-01-01 12:58:49,hacker_news
Worlds largest electric ship launched by Tasmanian boatbuilder,40,11,https://www.theguardian.com/australia-news/2025/may/02/hull-096-worlds-largest-electric-ship-battery-power-launched,2026-01-01 12:58:49,hacker_news
"If childhood is half of subjective life, how should that change how we live?",63,49,https://moultano.wordpress.com/2025/12/30/children-and-helical-time/,2026-01-01 12:58:49,hacker_news
A Christmas Present to Myself – Vector Network Analyzer (2014),3,1,https://axotron.se/blog/vector-network-analyzer-a-christmas-present-to-myself/,2026-01-01 12:58:52,hacker_news
Cameras and Lenses (2020),100,10,https://ciechanow.ski/cameras-and-lenses/,2026-01-01 18:40:14,hacker_news
OpenWorkers: Self-Hosted Cloudflare Workers in Rust,200,64,https://openworkers.com/introducing-openworkers,2026-01-01 18:40:14,hacker_news
iOS allows alternative browser engines in Japan,134,64,https://developer.apple.com/support/alternative-browser-engines-jp/,2026-01-01 18:40:14,hacker_news
Python Numbers Every Programmer Should Know,92,40,https://mkennedy.codes/posts/python-numbers-every-programmer-should-know/,2026-01-01 18:40:14,hacker_news
Implementing HNSW (Hierarchical Navigable Small World) Vector Search in PHP,47,13,https://centamori.com/index.php?slug=hierarchical-navigable-small-world-hnsw-php&lang=en,2026-01-01 18:40:14,hacker_news
Common Lisp SDK for the Datastar Hypermedia Framework,30,7,https://github.com/fsmunoz/datastar-cl,2026-01-01 18:40:14,hacker_news
Memory Subsystem Optimizations,5,1,https://johnnysswlab.com/memory-subsystem-optimizations/,2026-01-01 18:40:14,hacker_news
Sony PS5 ROM keys leaked – jailbreaking could be made easier with BootROM codes,132,26,https://www.tomshardware.com/video-games/playstation/playstation-5-rom-keys-leaked-jailbreaking-could-be-made-easier-with-bootrom-codes,2026-01-01 18:40:14,hacker_news
Build a Deep Learning Library,37,5,https://zekcrates.quarto.pub/deep-learning-library/,2026-01-01 18:40:14,hacker_news
Heap Overflow in FFmpeg EXIF,48,9,https://bugs.pwno.io/0014,2026-01-01 18:40:14,hacker_news
"C-events, yet another event loop, simpler, smaller, faster, safer",9,0,https://zelang-dev.github.io/c-events/,2026-01-01 18:40:14,hacker_news
2025 Letter,128,75,https://danwang.co/2025-letter/,2026-01-01 18:40:14,hacker_news
Children and Helical Time,111,93,https://moultano.wordpress.com/2025/12/30/children-and-helical-time/,2026-01-01 18:40:14,hacker_news
Meta made scam ads harder to find instead of removing them,205,55,https://sherwood.news/tech/rather-than-fully-cracking-down-on-scam-ads-meta-worked-to-make-them-harder/,2026-01-01 18:40:14,hacker_news
Rust--: Rust without the borrow checker,86,116,https://github.com/buyukakyuz/rustmm,2026-01-01 18:40:14,hacker_news
ACM Is Now Open Access,260,39,https://www.acm.org/articles/bulletins/2026/january/acm-open-access,2026-01-01 18:40:15,hacker_news
European Space Agency hit again as cybercriminals claim 200 GB data up for sale,29,12,https://www.theregister.com/2025/12/31/european_space_agency_hacked/,2026-01-01 18:40:16,hacker_news
A font with built-in TeX syntax highlighting,29,5,https://rajeeshknambiar.wordpress.com/2025/12/27/a-font-with-built-in-tex-syntax-highlighting/,2026-01-01 18:40:17,hacker_news
"Beyond the Nat: Cgnat, Bandwidth, and Practical Tunneling",17,6,https://blog.rastrian.dev/post/beyond-the-nat-cgnat-bandwidth-and-practical-tunneling,2026-01-01 18:40:17,hacker_news
Show HN: I created a tool to design and create foamcore inserts for boardgames,39,11,https://boxinsertdesigner.com/,2026-01-01 18:40:17,hacker_news
A website to destroy all websites,343,195,https://henry.codes/writing/a-website-to-destroy-all-websites/,2026-01-02 02:22:49,hacker_news
Happy Public Domain Day 2026,13,0,https://publicdomainreview.org/blog/2026/01/public-domain-day-2026/,2026-01-02 02:22:49,hacker_news
Can Bundler be as fast as uv?,155,57,https://tenderlovemaking.com/2025/12/29/can-bundler-be-as-fast-as-uv/,2026-01-02 02:22:49,hacker_news
Finland detains ship and its crew after critical undersea cable damaged,284,244,https://www.cnn.com/2025/12/31/europe/finland-estonia-undersea-cable-ship-detained-intl,2026-01-02 02:22:49,hacker_news
Linux is good now,486,409,https://www.pcgamer.com/software/linux/im-brave-enough-to-say-it-linux-is-good-now-and-if-you-want-to-feel-like-you-actually-own-your-pc-make-2026-the-year-of-linux-on-your-desktop/,2026-01-02 02:22:49,hacker_news
"Show HN: Enroll, a tool to reverse-engineer servers into Ansible config mgmt",57,11,https://enroll.sh,2026-01-02 02:22:49,hacker_news
WebAssembly as a Python Extension Platform,32,0,https://nullprogram.com/blog/2026/01/01/,2026-01-02 02:22:49,hacker_news
Show HN: OpenWorkers – Self-hosted Cloudflare workers in Rust,372,114,https://openworkers.com/introducing-openworkers,2026-01-02 02:22:49,hacker_news
Dell's version of the DGX Spark fixes pain points,99,46,https://www.jeffgeerling.com/blog/2025/dells-version-dgx-spark-fixes-pain-points,2026-01-02 02:22:49,hacker_news
"BYD Sells 4.6M Vehicles in 2025, Meets Revised Sales Goal",176,262,https://www.bloomberg.com/news/articles/2026-01-01/byd-sells-4-6-million-vehicles-in-2025-meets-revised-sales-goal,2026-01-02 02:22:49,hacker_news
Python numbers every programmer should know,283,127,https://mkennedy.codes/posts/python-numbers-every-programmer-should-know/,2026-01-02 02:22:49,hacker_news
Straussian Memes,21,24,https://www.lesswrong.com/posts/CAwnnKoFdcQucq4hG/straussian-memes-a-lens-on-techniques-for-mass-persuasion,2026-01-02 02:22:50,hacker_news
50% of U.S. vinyl buyers don't own a record player,125,149,https://lightcapai.medium.com/the-great-return-from-digital-abundance-to-analog-meaning-cfda9e428752,2026-01-02 02:22:50,hacker_news
"Moving Images Related to the Apollo Missions, 1967–1969",34,3,https://catalog.archives.gov/id/133360601,2026-01-02 02:22:50,hacker_news
Why Prefer Textfiles? (2010),15,9,http://textfiles.com/uploads/textfiles.txt,2026-01-02 02:22:50,hacker_news
"Quickemu: Quickly create and run optimised Windows, macOS and Linux VMs",115,21,https://github.com/quickemu-project/quickemu,2026-01-02 02:22:50,hacker_news
I rebooted my social life,341,278,https://takes.jamesomalley.co.uk/p/this-might-be-oversharing,2026-01-02 02:22:50,hacker_news
Bypassing a Clever CD-Check,10,2,https://www.davidschlachter.com/misc/no-cd-patch,2026-01-02 02:22:50,hacker_news
"Show HN: Feather – a fresh Tcl reimplementation (WASM, Go)",11,2,https://www.feather-lang.dev,2026-01-02 02:22:50,hacker_news
All my Deutschlandtickets gone: Fraud at an industrial scale [video],100,42,https://media.ccc.de/v/39c3-all-my-deutschlandtickets-gone-fraud-at-an-industrial-scale,2026-01-02 02:22:50,hacker_news
